,Date,Company,Article
42,2018-10-08,IOC,"National interest prompted Re 1 roll-back: HPCL chief


Public sector oil marketing companies will continue to maintain a discount of Re 1 a litre on petrol and diesel, till being asked not to, by the Centre.
Speaking on the sidelines of the Energy Forum, Hindustan Petroleum Chairman, M K Surana, told BusinessLine, “The price cut has been effected as per the directives of the Finance Minister. It is in the national interest.”
Surana said there has been no official letter or communication from the Centre to regulate prices.
On Thursday, Finance Minister Arun Jaitley had asked PSU oil companies to cut the price of petrol and diesel by Re 1 each. This was in addition to an excise duty rollback of Re 1.50 a litre on both fuels.
Oil companies price auto fuels by benchmarking them to international prices, according to a formula.
Explaining the mechanism for the price lowering, Surana said, “Whatever be the price according to the formula, it will be lowered by a rupee till further notice from the Centre.”
Despite the Centre’s directive, the oil companies maintained that prices of auto fuels are deregulated. Oil company officials said the government in its capacity as the largest shareholder can direct the price lowering.
“The impact of the Re 1 hit on margins will be lowered from the revenues while reporting results,” Surana said.
Indian Oil Chairman, Sanjiv Singh said, “Petrol and diesel prices continue to be deregulated. The impact of the Re 1 per litre cut on revenue is expected to be Re 4,000- Re 5,000 crore for the next six months.”"
41,2018-10-14,IOC,"Oil marketing companies: Value in the pipeline
The stocks of the public sector oil-marketing companies (OMCs) — Indian Oil, BPCL and HPCL — were hammered down 25-35 per cent in just two trading sessions on October 4 and 5. This sucker punch was the market’s strong show of disapproval to the Centre’s move to force these companies to take price cuts of ₹1 per litre on petrol and diesel as part of the price relief package for customers. 
On its part, the Centre cut excise duty on these fuels by ₹1.5 per litre, and the Finance Minister urged States to reduce sales/value-added tax (VAT) by ₹2.5 a litre to bring the total relief to ₹5 a litre. 
Rapidly rising global crude-oil prices, the rupee’s rout, and high excise duty and VAT, combined together, were propelling petrol and diesel prices to all-time highs on a daily basis. With customers getting increasing restive, the Centre, under pressure, finally cut excise duties after holding out for a long time. In the process, it also made the oil companies sacrifice.
While customers were somewhat relieved, the market voted with its feet at the forced co-option of the OMCs in the cost cuts. There is a strong fear that this move signals the end of fuel-price deregulation — the key reform that was instrumental in improving the fortunes of the OMCs over the past few years. Petrol pricing was decontrolled in 2010, and that of diesel in 2014. While the Finance Minister has stated that pricing of the fuels remains deregulated and that the OMCs could continue to adjust prices with market movements, the market seems unconvinced.
That’s because a pattern has emerged of the OMCs capitulating to the diktats of the government — their major shareholder — and losing their pricing freedom on petrol and diesel in the poll season — the companies go slow or temporarily freeze price hikes altogether. 
This happened during the run-up to the Gujarat elections last Decemberm and repeated itself prior to the Karnataka elections in May. As a result, the marketing margins of the OMCs took a sharp knock. But when the poll season was behind them, the oil firms made up the lost ground by hiking prices; marketing margins went up again.
The market has been worried whether this recoup-after-elections phenomenon will be possible in the coming months, with an intense election cycle on the cards. 
Elections in Rajasthan, Madhya Pradesh, Telangana, Mizoram and Chhattisgarh are lined up for the end of the year and the Lok Sabha elections is likely to be held sometime in April. Even before the latest rout, the OMC stocks had been big losers — losing 30-50 per cent over a year.
The latest arm-twisting of the OMCs by the Centre only adds to the apprehensions of the market. There is continued uncertainty about the trajectory of both oil and the rupee, and the Centre’s financial position is tight. There are worries that in the event oil prices again rise sharply or the rupee’s rout continues, the OMCs will be again told to cut fuel prices. The stocks’ recent crash has more to do with seriously soured sentiments than the financial impact of the ₹1-per-litre cut. In all, after a strong run from 2013-end until last year, the OMC stocks have shed about 40-55 per cent or more over the past year or so. 
Valuations are also down sharply. The Indian Oil stock now trades at about fives times trailing 12-month earnings, compared with the three-year average of 10 times. Similarly, the stocks of HPCL and BPCL are trading at about four times and 5.5 times, much lower than their three-year averages of about 8.5 times and 12 times. The stocks seem to have been de-rated on the concerns about the lack of pricing freedom.
Does this sharp fall present a buying opportunity? Maybe, but only if you have a stomach for high risks and a long-term horizon. There is danger — in the short-term, at least — that the OMCs may again be made patsy to keep petrol and diesel prices under check. But on the other hand, there are certain factors that make for an investment case now.
One, heavy value-destruction in the OMC stocks harms their major shareholder — the Centre — too, and could sharply reduce the latter’s inflows in the future when it may seek to divest stakes in these companies. 
The Centre will hopefully take lessons from the recent carnage and become more creative in the future when it comes to price cuts. It could direct the OMCs — arguably, still in good financial health — to pay higher dividends, and cut excise duties from these proceeds, instead of asking the OMCs to cut prices on their own. If this were done, the monetary implications for the Centre will largely be the same, but the market sentiment for the OMC stocks could improve. 
Next, coming to dividends, the OMC stocks are likely to continue paying healthy dividends, come rain or shine. Over the past three fiscal years, the dividend per share has been ₹14-35. The combination of high dividends and stock price decline translates into high dividend yields. After the recent crash, the dividend yield is 7-8 per cent for these three stocks. 
Finally, despite the pulls and pressures, earnings growth has remained healthy for the OMCs, aided by expansions and inventory gains. While the price freezes and cuts will have some impact, earnings should continue growing at a good pace over the long run, with the companies expanding and upgrading their capacities. Besides, it is unlikely that the government will completely roll back the pricing reforms that had ushered in huge positive change over the past few years. It is likely that, in less than a year, when the election dust settles, true pricing freedom will be restored to the OMCs."
40,2018-10-24,IOC,"Oil marketing stocks jump over 7%


Hindustan Petroleum Corporation Ltd jumped 7.16 per cent, Indian Oil Corporation Ltd gained 5.54 per cent and Bharat Petroleum Corporation Ltd rose 4.74 per cent on the BSE.
   -  THE HINDU




Hindustan Petroleum Corporation Ltd jumped 7.16 per cent, Indian Oil Corporation Ltd gained 5.54 per cent and Bharat Petroleum Corporation Ltd rose 4.74 per cent on the BSE.
   -  THE HINDU


Shares of oil marketing companies like HPCL, IOC and BPCL surged up to 7.2 per cent on easing global crude oil prices. Hindustan Petroleum Corporation Ltd jumped 7.16 per cent, Indian Oil Corporation Ltd gained 5.54 per cent and Bharat Petroleum Corporation Ltd rose 4.74 per cent on the BSE.
Brent crude prices fell 4.37 per cent, its biggest single-day fall in three months, to $76.24 barrel on Tuesday. The benchmark oil was trading at $76.72 per barrel on Wednesday.
Aviation stocks also made gains on Wednesday. Shares of Jet Airways surged 3.76 per cent, SpiceJet rose 1.85 per cent and InterGlobe 0.80 per cent on the BSE. In the broader market, the BSE key index surged 186.73 points to close at 34,033.96."
39,2018-11-01,IOC,"Hughes wins mandate from OMCs to automate retail network 
 Hughes Communications India Ltd Thursday said all three state-owned oil marketing companies have selected its satellite broadband system to automate their retail network.
“Under separate contracts, Indian Oil Corporation (IOC), Bharat Petroleum Corporation Ltd (BPCL), and Hindustan Petroleum Corporation Ltd (HPCL) will each use the JUPITER system to upgrade network connectivity across 19,000 locations collectively to increase speed of transactions, eliminate manual interference, and deliver accurate, real-time data across the retail operations,” the company said in a statement.
Hughes Communications India is majority-owned subsidiary of Hughes Network Systems, LLC, the global leader in broadband satellite solutions and services.
“In addition to driving cost savings, our Hughes technology and managed services will help the companies take control over applications such as monitoring of tank levels at petrol pump outlets, checking and reducing pilferage, and ensuring updated pricing across all retail outlets across the country on a daily basis, enhancing customer satisfaction and achieving transparency in their operations,” said Partho Banerjee, president and managing director, Hughes India.
The managed network solution the companies have chosen from Hughes encompasses deployment and management of the JUPITER System, including rental of VSATs (Very Small Aperture Terminal) for five years.
Central management by Hughes will ensure high-speed connectivity and uptime with 24/7 support and monitoring, helping relieve the oil majors from network management while giving them data access, the statement said, adding the system will enable data transfers, loyalty card administration, web-based applications and banking transactions, as well as remote viewing of outlets."
38,2018-11-05,IOC,"Indian Oil Corp shares fall most in a month


indianoil-logo




indianoil-logo


Shares of the country's top refiner, Indian Oil Corporation Ltd , down as much as 4.30 per cent to Rs 141.85 rupees, biggest daily per cent fall since October 5
The compan;y's second quarter profit fell 12.2 per cent to Rs 3,247 crore missing estimate by a wide margin, as forex expenses and raw material costs weighed on the stock
The September quarter  GRM at $6.79/bbl, down from $7.98/ bbl year ago, co said on Friday
Oil prices fell today as the start to U.S. sanctions against Iran's fuel exports was softened by waivers that will allow major buyers to still import Iranian crude, at least temporarily, including India."
37,2018-11-07,IOC,"IOCL gets new Executive Director
 
DL Pramodh has taken over as Executive Director, IndianOil, Karnataka State Office, Bengaluru, and State-level coordinator of oil industry in Karnataka. Prior to this posting, Pramodh was Executive Director (Institutional Business) at IndianOil’s marketing division headquarters in Mumbai. A mechanical engineer, he joined IndianOil in 1986. Pramodh has experience in handling various portfolios such as LPG, retail sales and institutional business in various capacities spreading across Rajasthan, Uttar Pradesh, Gujarat, Maharashtra and Tamil Nadu."
36,2018-11-14,IOC,"HPCL shares rally over 12%, IndianOil 10%
Shares of Hindustan Petroleum Corp Ltd, Bharat Petroleum Corp Ltd and Indian Oil Corp Ltd jumped 8.7 per cent-12.4 per cent as oil prices slumped. Oil markets struggled to find their footing on Wednesday after a 7 per cent plunge in the previous session, with oversupply and the spectre of faltering demand keeping investors on edge.
Hindustan Petroleum climbed as much as 12.4 per cent to its highest since September 24; the stock was the top percentage gainer on the NSE index. IndianOil climbed as much as 10 per cent, in its sharpest intraday percentage jump since August 4, 2017.
Aviation stocks also climbed, with Interglobe Aviation Ltd rising 6.6 per cent to an 11-week high. Jet Airways (India) Ltd rose 3.7 per cent, while SpiceJet Ltd advanced 5 per cent ahead of its quarterly results."
46,2018-11-14,IOC,"City gas retail licence: Adani, IOC, BPCL, Torrent Gas emerge big winners


The present round will double the city gas coverage.




The present round will double the city gas coverage.


 Oil regulator PNGRB on Monday declared the final list of winners of city gas retailing licences that had Gautam Adani’s group, state-owned Indian Oil Corp, Bharat Petroleum Corp Ltd and Torrent Gas as the big winners.
Adani Gas won rights to retail CNG to automobiles and piped cooking gas to households and industries in 13 cities on its own and another nine, including Allahabad, in a joint venture with IOC, according to results of 84 cities that were auctioned in the country’s biggest city gas distribution (CGD) bid round.
According to the list of winners put out by the Petroleum and Natural Gas Regulatory Board (PNGRB), IOC on its own won rights to seven cities, including Coimbatore and Salem in Tamil Nadu, and Guna in Madhya Pradesh.
Bharat Gas Resources Ltd, a unit of state-owned BPCL, won a licence for 11 cities like Amethi and Rai Bareli in Uttar Pradesh and Ahmednagar in Maharashtra, while Torrent Gas Pvt Ltd made 10 winning bids that included ones for Chennai, Alwar in Rajasthan, Moradabad in Uttar Pradesh and Karaikal in Puducherry.
State gas utility GAIL’s retailing arm, GAIL Gas, managed rights for five cities, including Dehradun.
Indraprastha Gas Ltd, the firm that retails CNG in the national capital, won city gas rights for Meerut and Muzaffarnagar in Uttar Pradesh.
Hindustan Petroleum Corp Ltd (HPCL) and Gujarat Gas won rights for one city each while Green Gas got licences for two and Maharashtra Natural Gas Ltd for three.
Other winners included smaller players like IRM Energy, Haryana City Gas, Essel Gas, Megha Engineering & Infrastructure Ltd, Tripura Natural Gas, and Assam Gas.
PNGRB said a total of 4,346 CNG stations have been committed to be set up in the 84 Geographical Areas (GAs) in eight years. Also, the entities have committed to provide 2.1 crore piped natural gas connections to households kitchens by September 30, 2026.
When the ninth CGD bidding round closed in July, IOC, BPCL and Adani Gas were the top bidders. As many as 86 cities were offered in the bid round but results of two have been withheld pending legal challenge mounted by certain bidders.
Of the 86 cities offered for retailing of CNG to automobiles and piped cooking gas to households in the ninth CGD bid round, IOC bid for 34 cities on its own and another 20 in partnership with Adani Gas.
Adani Gas on its own bid for 32 cities. Bharat Gas Resources Ltd bid for as many as 53 cities, while GAIL Gas Ltd put in offers for 34 cities. Gujarat-based Torrent Gas Pvt Ltd bid for 31 cities, while Gujarat Gas Ltd put in offers for 21 areas.
Petronet LNG Ltd, India’s largest liquefied natural gas importer, sought to foray into CGD business by bidding for a licence in seven cities but drew a blank. Indraprastha Gas Ltd had put in bids for 11 cities.
PNGRB said the ninth CGD bidding round was launched on April 12 for development of city gas networks for the 86 geographical areas (GAs) which includes 174 districts (156 complete and 18 part), spread over 22 states and Union Territories (UTs) in India.
The present round will double the city gas coverage. At present, CGD authorisation has been given by PNGRB for 92 GAs covering 124 districts spread over 23 States and UTs."
35,2018-11-21,IOC,"Aviation, OMCs rise as global crude oil prices fall
 Shares of aviation and oil marketing companies (OMC) surged up to 6 per cent on Wednesday due to a sharp fall in the global crude oil prices.
 The scrip of SpiceJet soared 5.63 per cent, Jet Airways 2.74 per cent and InterGlobe Aviation 1.41 per cent on the BSE.
 Among OMCs, shares of Indian Oil Corporation (IOC) rose by 1.76 per cent, Hindustan Petroleum Corporation Limited (HPCL) rose by 1.17 per cent and Bharat Petroleum Corporation Limited rose by(BPCL) 1.08 per cent.
 Crude oil fell to a one-year low in the global market.
 Brent crude, the oil prices international benchmark, fell 6.92 per cent to USD 62.17 a barrel on Tuesday on excess supply concerns."
34,2018-12-08,IOC,"Oil PSUs to add 4,500 petrol pumps across Gujarat 


FILE PHOTO




FILE PHOTO


 Indian Oil, Bharat Petroleum and Hindustan Petroleum have an ambitious plan to open nearly 4,500 fuel outlets across Gujarat, an official said on Saturday.
Talking to reporters here, Indian Oil Chief Regional Manager Sunil Vikramsingh said, “To meet the increasing requirements of customers on highways, agricultural sector products and industries, it was observed necessary to open such fuel outlets in the state.” 
“IOCL, BPCL and HPCL have an ambitious plan to open nearly 4,500 fuel outlets in the state,” he said. About 3 to 4 fuel outlets will be opened near the Statue of Unity, dedicated to Sardar Vallabhbhai Patel and the world’s tallest statue, at Kevadiya in neighbouring Narmada district, he added.
 More than three lakh visitors have already visited the site. Therefore, opening of three to four fuel outlets will help the tourists, the official said. The OMCs (oil marketing companies) plan to expand in tier II and III cities as well as rural areas, interior areas and remote areas as they lack presence in these geographies.
 The Indian Oil will set up 128 retail outlets, with Bharat Petroleum 50 and Hindustan Petroleum 49 in Vadodara district of Gujarat. “All these OMCs are set to expand their fuel retail network after a gap of nearly four years, which is due to eight per cent annual growth in sale of petrol and four per cent in diesel,” Vikramsingh said. The OMCs have formally announced their plans and bidding process for inviting tenders has also started, he said, adding that each fuel outlet will cost between Rs 60 lakh to Rs 3 crore depending on their location.
 “The OMCs for the first time have come together to work on such a scale to avoid duplication and eating into each other’s business,” he added. Retail outlets opened after 2014 were largely through the revival of old stations or restoration of dealerships that had been terminated because of non-performance since 2005. Under the new dealership guidelines, the educational qualification for a dealer has been lowered to Class X pass from the previous requirement of being a graduate and the upper age limit has been raised to 60 years from 45."
33,2018-12-12,IOC,"IOC: Focus on buyback, dividend payment
 
The board of directors of Indian Oil Corporation will meet on Thursday to consider buyback of fully paid-up equity shares of the company, and declaration of an interim dividend for the financial year 2018-19. It may be recalled that the PSU oil company in March had rewarded its shareholders with a 1:1 bonus issue. Besides payout details, shareholders will also eye the issue size, price and mode (through open market purchase or tender route) of the buyback."
32,2018-12-13,IOC,"IOC to buy back 30 crore shares
Indian Oil Corporation has announced share buyback of over 29.76 crore shares and also decided to give interim dividend at the rate of ₹6.75.
These decisions will benefit the government and over 4.68 lakh investors of the company which also include 4.5 lakh individual investors. All the investors who are on the books of the company as on December 25, (record date) will be eligible for the buyback and interim dividend. These decisions were taken at the board meeting held here on Thursday.
According to a regulatory filing, “Buyback of equity shares of the company not exceeding 29,76,51,006 equity shares being approximately 3.06 per cent of the total paid-up equity share capital of the company at a price of ₹149 per equity share payable in cash for an aggregate consideration not exceeding ₹4,435 crore…” All equity shareholders of the company, as on the record date, will be allowed to tender shares on proportionate basis.
“The public announcement setting out the process, timelines and other requisite details will be released in due course in accordance with the buyback regulations,” the company said. The buyback price is at an 8.6 per cent premium to Thursday’s closing price of IOC’s stock on the BSE.
The IOC stock closed 0.5 per cent higher at ₹137.20 on the exchange. The government, which holds 54.06 per cent stake in the company, is expected to participate in the share buyback. Back-of-the-envelop calculation shows the government could get up to ₹2,400 crore through the buyback.
The government is targeting a minimum ₹5,000 crore through share buyback offers of various Central Public Sector Undertakings (CPSUs) such as Coal India, BHEL and Oil India. Besides IOC, at least half a dozen other central CPSUs have disclosed share buyback programmes. These include NHPC, BHEL, NALCO, NLC, Cochin Shipyard and KIOCL.
The Department of Investment and Public Asset Management (DIPAM), which has a target of raising ₹80,000 crore for the government through stake-sale in CPSEs, had prodded all cash-rich PSUs to go for share buybacks. CPSUs having a net worth of at least ₹2,000 crore and cash balance of more than ₹1,000 crore have to mandatorily go in for share buybacks. Of the ₹80,000-crore disinvestment target, the government has so far raised just over ₹15,000 crore through minority stake-sale in PSUs.
The board of directors declared an interim dividend of 67.5 per cent or ₹6.75 a share (face value ₹10) for the financial year 2018-19. The dividend will be credited to the account of the shareholders or the dividend warrant in respect thereof will be dispatched on or before December 31.
The government is expected to get ₹3,544 crore, apart from dividend distribution tax on the entire amount of dividend."
31,2018-12-19,IOC,"IOC to turn ex-date for dividend, buyback
Shares of Indian Oil Corporation will remain in focus, as they turn ex-date for the proposed buyback as well as dividend. The company is paying ₹6.75 a share as interim dividend. IOC plans to buy back over 29.76 crore shares, approximately 3.06 per cent of the total paid-up equity share capital of the oil retailer, at a price of ₹149 a share. Investors who wish to receive the dividend and to participate in the buyback offer need to own the company’s shares by Thursday."
30,2018-12-23,IOC,"SMEs adopt automation to take on global players


Automating the loading system reduces time and manpower needed, says Shailesh Gupta
   -  THE HINDU




Automating the loading system reduces time and manpower needed, says Shailesh Gupta
   -  THE HINDU


When Shailesh Gupta, Director of Faridabad-based HT Process Controls, manufacturer of LPG and bitumen filling equipment, embarked on an automation project for one of the customers — Indian oil Corporation (IOCL) — the company’s revenue shot up by seven times in the next three years.
 HT Process Controls, in collaboration with Wisconsin-headquartered Rockwell Automation and its Indian partners, has developed a solution for automating the process of filling and loading of LPG cylinders. 
“The robotic loading system is a gantry robot. Its function is to fill propane bottles and load them on to the trucks. Today, it is a manual job and its efficiency cannot be constant, given the hot summer season and the possibility of accidents,” Gupta said. 
“Automating the process helped to reduce loading time from 25 to 12 minutes and manpower from three people to zero,” he added. It also helped to reduce risk factors emerging from potential accidents in which both people and equipment can be harmed. 
After completing the two-year-long tests of first such robotic loading system at one of the filling plants of IOCL, HT Process Controls is staring at a ₹500-crore opportunity.
“We see a potential of installing 200-250 more such systems only at IOCL. There is scope for installing at least 800 such systems in the entire industry. It could be a ₹500-600 crore opportunity,” Gupta told BusinessLine.
While Indian machinery builders are benefiting from various government schemes, they can also leverage technology to advance their offering to large OEMs and end-customers.
“The cost of automation quoted by large foreign players is 30-50 per cent higher than what Indian companies can offer, “ Gupta said. 
 While Industry 4.0, which stands for using automation and data analysis in the manufacturing processes, may not be on top of the minds of Indian SMEs, industry players believe SMEs will be the driving force for automation in the country, as they are trying to compete with foreign majors.
“SMEs involved in building machinery for various industries are competing with a few large global companies from Western Europe, China, and are able to win businesses from large customers in India because they have the ability to respond quickly,” Dillip Sawhney, MD- India, Rockwell Automation India told BusinessLine."
