,Date,Company,Article
29,2018-12-29,IOC,"With launch of Ujjwala scheme, 97% households in Karnataka have LPG connections 


IndianOil had extended loans to 1.88 crore Ujjwala beneficiaries for LPG Stove and/or their first LPG refills. File photo
   -  BusinessLine




IndianOil had extended loans to 1.88 crore Ujjwala beneficiaries for LPG Stove and/or their first LPG refills. File photo
   -  BusinessLine




Subsequent to the launch of the Pradhan Mantri Ujjwala Yojana (PMUY) scheme, LPG penetration in Karnataka has increased from 68.49 per cent in June 2014 to 96.75 per cent in December 2018.
“The number of LPG customers stood at 95.83 lakh as on June 1, 2014. It stood at 143.20 lakh as on December 1, 2018, which is an increase of 47.87 lakh in the last four years. Under the PMUY, 18.03 lakh connections have been released in Karnataka up to November 2018. Of this, Indian Oil Corporation accounted for 8 lakh connections, Bharat Petroleum Corporation 4.58 lakh and Hindustan Petroleum Corporation 5.4 lakh,” said D. L. Pramodh, Executive Director, Indian Oil Corporation, and state-level co-ordinator for the oil industry in Karnataka.
According to Census 2011, Karnataka had 133.55 lakh households and as per decadal growth, the number of households would be 48.01 lakh currently. Of these, the number of active customers would be 143.2 lakh, accounting for 96.75 per cent LPG coverage in the state.
To expand LPG coverage further, the Gram Swaraj Abhiyan was launched during June to August 2018, wherein LPG Panachayats were conducted throughout the state.
“A total of 1,440 villages in Karnataka were identified as having low LPG penetration. We are targeting them by initially releasing 2 lakh connections to the eligible beneficiaries,” said Pramodh.
The Extended Pradhan Mantri Ujjwala Yojana-2 (EPMUY) scheme has been approved by the Cabinet Committee on Economic Affairs (CCEA). In this scheme, BPL households not covered under the SECC data and EPMUY would be facilitated to avail of the PMUY LPG connection. “This scheme will lead to near 100 per cent LPG penetration in Karnataka, by releasing LPG connections to the poor adult women in rural households,” explained Pramodh.
Another one crore LPG connection are expected to be released across the country during the period January to April 2019."
28,2019-01-30,IOC,"IOC shares drop over 2% after Q3 results 
 Shares of Indian Oil Corp (IOC) on Wednesday fell over 2 per cent after it reported 91 per cent plunge in net profit for the December 2018 quarter. The scrip declined 2.07 per cent to close at Rs 134.65 on the BSE. Intra-day, it dropped 3.49 per cent to Rs 132.70. On the NSE, shares fell by 2.36 per cent to close at Rs 134.10.
The company logged a profit of Rs 716.82 crore, or Rs 0.76 per share, in the third quarter of 2018-19, showing a decline of 90.9 per cent year-on-year. In the year-ago period, the profit stood at Rs 7,883.22 crore, the company said in a regulatory filing.
The turnover rose to Rs 1.6 lakh crore from Rs 1.32 lakh crore."
27,2019-02-18,IOC,"IOC signs first annual deal for US oil


Sanjiv Singh, Chairman, Indian Oil Corporation. File photo




Sanjiv Singh, Chairman, Indian Oil Corporation. File photo


 Indian Oil Corporation (IOC) has signed its first annual deal to buy United States (US) oil, paying about $1.5 billion for 60,000 barrels a day in the year to March 2020 to diversify its crude sources, its chairman said on Monday.
IOC is the first state refiner to buy US oil under an annual contract, in a deal that will also help boost trade between New Delhi and Washington.
The company has previously purchased US oil from spot markets and signed a mini-term deal in August to buy 6 million barrels of US oil between November and January.
IOC chairman Sanjiv Singh said the annual contract will begin from April. He declined to give the name of the seller or pricing details, citing confidentiality.
A trade source, who is not authorised to speak to media, said IOC has signed the deal with Norwegian oil company Equinor .
Equinor, which has set up an office in New Delhi to support oil marketing and trading, did not immediately respond to an email seeking comment.
Indian Oil buys about 75 per cent of its oil needs through long-term deals, mostly with OPEC nations.
The term deal will help cut IOC's dependence on Organisation of the Petroleum Exporting Countries (OPEC) crude, said Sri Paravaikkarasu, head of east of Suez oil for consultants FGE in Singapore.
“Lots of geopolitical issues are going around. We expect lots of volume going away from Venezuela, west Africa and Iran, so it makes sense to have guaranteed term supplies from the US, where crude production is increasing,” she said.
“There is a push for diversification everywhere. South Korea is giving a freight rebate for non-Middle East crude imports,” she added.
India and the US, which have developed close political and security ties, are also looking to develop bilateral trade, which stood at $126 billion in 2017 but is widely seen to be performing well below its potential.
The two countries have set up seven groups of chief executives with top US and Indian firms to boost bilateral trade in areas including energy.
Last week Petronet LNG signed an initial deal to invest and buy LNG from Tellurian Inc's proposed Driftwood project in Louisiana in the US."
26,2019-03-07,IOC,"Modi launches IOCL’s Ennore LNG terminal


IndianOil, through its joint venture company IndianOil LNG Pvt. Ltd, has developed a 5-million tonnes per annum (mtpa) capacity LNG terminal.




IndianOil, through its joint venture company IndianOil LNG Pvt. Ltd, has developed a 5-million tonnes per annum (mtpa) capacity LNG terminal.




The ₹5,150-crore Liquefied Natural Gas (LNG) terminal at the Kamarajar port, Ennore, inaugurated by Prime Minister Narendra Modi, is expected to usher a ‘green wave’ in South-Eastern India by offering natural gas as a clean and economically viable fuel, which will also help in reducing the carbon footprint.
Conceived six years ago, this is the first LNG terminal on the East Coast in South India. Tamil Nadu will be the biggest beneficiary with the LNG to be supplied to customers in Manali region and to many units right up to Ramanathapuram down South.
IndianOil, through its joint venture company IndianOil LNG Pvt. Ltd, has developed a 5-million tonnes per annum (mtpa) capacity LNG terminal.
At present, there is very limited gas infrastructure in Tamil Nadu. To begin with, the terminal will meet the gas requirements of Manali area for customers such as Chennai Petroleum Corporation Ltd, Madras Fertilisers Ltd, Tamil Nadu Petroproducts and Manali Petrochemicals Ltd, said an IOC spokesperson.
In future, natural gas from the terminal will also be catering to the gas requirements of entire Tamil Nadu and parts of Karnataka and Andhra Pradesh.
The terminal will supply natural gas to various consumers with IndianOil by laying a 1,244-km pipeline for evacuation of natural gas. It will pass through Manali, Thiruvallur, Puducherry, Nagapattinam, Madurai, Tiruchi, Tuticorin, and Ramanathapuram, and a separate line to Bengaluru via Hosur.
The terminal has received all necessary clearances for commissioning. IndianOil has arranged LNG commissioning cargo from Swiss Trader, Gunvor. 
The first LNG cargo was delivered through LNG ship ‘Golar Snow’ from Qatar. The ship was berthed on February 26 at the LNG jetty for commissioning of the terminal.
The Ennore LNG terminal project and associated pipeline infrastructure projects cumulatively account for investments of about ₹9,000 crore, the spokesperson said.
The terminal is part of India’s plan to enhance the share of natural gas in the country’s energy basket from the present 6.2 per cent to 15 per cent by the year 2030.
Kamarajar Port Ltd chairman (holding additional charge) P Raveendran said KPL has allotted 128 acres of land and 362 m of water front to Indian Oil LNG — a special purpose vehicle. This is the largest single project investment in KPL, he added.
From the port side, the project consists of two sets of facilities — one in the marine side that includes jetty for berthing the LNG vessels and unloading facilities; and second is landside facilities of storage and re-gasification tank farms, which are the distribution points for the LNG through pipelines. Both the facilities are connected through pipelines. 
“Kamarajar is sure to emerge as the trendsetter for other ports in East Coast, “ he said.
By adding this facility, KPL achieves an installed capacity of 62 MT and with other on-going projects and in line with business plan, KPL aims to achieve 142 MT of capacity by the year 2025, Raveendran said.
Through a video link from Kancheepuram, Modi also laid the foundation stone for four-laning of NH-45C from Vikravandi to Thanjavur and the six-laning of Karaipettai to Walajapet section of NH-4. He also dedicated the electrification of Erode-Karur-Tiruchchirapalli and Salem-Karur-Dindigul railway lines."
25,2019-03-07,IOC,"Contracts signed for 23 blocks under Discovered Fields - II 


Blocks relinquished earlier by ONGC and OIL are offered in the bid rounds




Blocks relinquished earlier by ONGC and OIL are offered in the bid rounds




The Centre has signed contracts with winners of blocks awarded under the Discovered Small Fields (DSF) Bid Round-II.
Oil and Natural Gas Corporation (ONGC) has bagged five blocks, while Oil India Limited (OIL) has cornered two blocks in this round. 
A joint venture of IndianOil Corporation Limited (IOCL) and Hindustan Oil Exploration Company (HOEC) has won one block.
The remaining 15 blocks are private sector awardees, with Ganges Geo Resources Private Limited cornering the lion’s share with five blocks. Vedanta Limited, Arch Softwares Private Limited, Shanti G.D. Ispat and Power Private Limited and Bagadiya Brothers Private Limited have got two blocks each.
Speaking at the event, Dharmendra Pradhan, Minister for Petroleum and Natural Gas, said, “Fifteen companies have been provided with E&P contracts, interestingly eight among these are new entries in the sector… Our government has changed its priority from revenue-centric governance to production-centric. Increased local production means lower energy import bills, which, in turn, means more resources to commit towards developmental issues.”
The bid submission process in this round was completed on January 30, 2019.
The bidding started on August 9, 2018 with 25 contract areas on offer covering 59 discovered oil and gas fields. These fields are spread over 3,000 sq km with prospective resource base of over 190 million tonnes of oil and oil equivalent gas.
Under DSF Bid Round-II, a total of 145 bids were received in 24 Contract Areas, an official statement said."
24,2019-04-05,IOC,"IOC stops fuel supply to Jet Airways 


IOC stopped supplying fuel to the cash-starved carrier from 12 noon on Friday, sources said. File photo




IOC stopped supplying fuel to the cash-starved carrier from 12 noon on Friday, sources said. File photo


 Indian Oil Corporation (IOC) on Friday stopped fuel supply to the struggling carrier Jet Airways for non-payment.
The public sector oil marketing firm stopped supplying fuel to the cash-starved carrier from 12 noon on Friday, sources said.
Jet Airways, in which State Bank of India (SBI)-led consortium of lenders is set to take management control under a debt-recast plan, has drastically curtailed operations with a fleet of 26 planes.
On March 25, Jet Airways board had approved a resolution plan formulated by SBI-led domestic lenders, under which had agreed to infuse an emergency funding of Rs 1,500 crore into the airline, and convert the same into equity worth 50.1 per cent for a notional value of just Re 1 each share.
 The airline, however, has not yet received the much-needed funds."
23,2019-04-17,IOC,"Indian refiners turn to OPEC, Mexico, US to make up Iran oil gap


IOC will cut Iranian oil imports to six million tonnes. File photo
   -  Reuters




IOC will cut Iranian oil imports to six million tonnes. File photo
   -  Reuters


 Indian refiners are increasing their planned purchases from the Organisation of Petroleum Exporting Countries (OPEC), Mexico and the United States (US) to make up for any loss of Iranian oil, sources and company officials said.
All four Indian state-owned refiners that buy Iranian oil are confident of securing additional barrels from other producers, officials from the companies said.
The state refiners have not yet placed orders for Iranian oil for May, when the current waiver expires, pending clarity from the US.
Bharat Petroleum Corp (BPCL) and Mangalore Refinery and Petrochemicals Ltd (MRPL) have tapped Iraq to make up for Iranian oil, while Indian Oil Corp (IOC) has signed its first annual contract with US suppliers and raised supplies from Mexico.
“There will be no supply constraints. The supply can come from both OPEC and non-OPEC nations like the US,” said MK Surana, chairman of Hindustan Petroleum Corp, which purchased up to 1.5 million tonnes per year of Iranian crude in 2018/19.
The OPEC and other producers including Russia have gradually tightened supply through 2019 to reduce a global glut. OPEC and its partners may not renew the curbs when they expire after June because of the risk of over-tightening the market.
IOC, Iran's biggest Indian client, will cut Iranian oil imports to six million tonnes, or about 120,000 barrels per day, in the 2019/20 period from nine million in 2018/19. It has also raised the optional volumes it can buy from other producers to two million tonnes, a company official said.
“Our optional quantities under term deals are higher than last year. We have optional contracts with Saudi Arabia, Kuwait and other suppliers. They will supply more if we want,” the official said, adding his firm would also buy more US oil if required.
IOC also hopes to buy 1.5 million tonnes of Mexican oil in 2019, compared with 1 million tonnes last year, the source said.
Officials from state-owned National Iranian Oil Co did not immediately reply to requests for comment on the Indian refiners' plans to purchase less Iranian crude.
Refinery officials said their 2019/20 crude import strategy was not contingent on Iranian oil, and was more flexible than in previous years.
“We don't have a watertight plan for the year, we have optional quantities so that it is possible to find replacement if any country goes out for any reason,” said an MRPL official.
During previous sanctions against Iran, Saudi Arabia and Iraq raised supplies to India to grow market share in the country, the world's third-biggest oil consumer and importer.
Last year, MRPL signed its first annual deal with Iraq to buy 1.5 million tonnes of Basra oil in 2019.
BPCL has signed a deal to buy 5 million tonnes of Iraqi oil in 2019 compared with 1.5 million tonnes in 2018, its head of refineries R Ramachandran said, adding his company is considering buying more oil from South America.
BPCL recently bought Brazilian crude and plans to buy Mexican oil as well, he said.
“We have a strategy with and without Iran,” he added."
22,2019-04-22,IOC,"Oil marketing companies share plunge as crude hits near 6-month high


The shares of Indian oil marketing companies on Monday skid after global crude prices rallied by about 3 per cent to levels last seen in Nov 2018.
Oil prices shot up after United States announced that all buyers of Iranian oil will have to end their imports shortly, or be subject to U.S. sanctions. Removing the sanctions exemptions would reduce oil supply from a market that is already tight because of U.S. sanctions against Iran and fellow OPEC-member Venezuela.
Hindustan Petroleum Corp Ltd shares fell over 6 per cent to ₹ 250.50 in its worst intra-day per cent fall since November 12. 
The shares of Bharat Petroleum Corp Ltd plunged as much as 5.2 per cent to ₹ 344.10, its biggest intra-day fall in nearly 5 weeks and while that of Indian Oil Corp Ltd was down 4.2 per cent to ₹ 149.50 in worst intra-day fall since April 8."
21,2019-04-26,IOC,"Fitch Ratings sees risks to OMCs as Centre seeks more returns 


Representative image
   -  AFP




Representative image
   -  AFP


 Financial profiles of state-owned oil marketing companies such as Indian Oil Corp (IOC) may be at risk in the near to medium term due to pressure from the Central Government to increase shareholder returns, Fitch Ratings said on Friday.
Struggling to meet budget targets, the Government had in the recently concluded fiscal (2018-19) asked cash-rich public sector units (PSUs) to pay second interim dividend as well as undertake share buyback. The share buybacks, wherein a company re-purchases its shares and extinguishes them, helped the government get money while maintaining its control over them. 
“The oil marketing companies (OMCs) IOC, Bharat Petroleum Corporation Ltd (BPCL) and upstream entity Oil India Ltd (OIL) declared high interim dividends of 67.5 per cent to 110 per cent of the face value of their shares, and undertook share buybacks in the financial year ended March 31, 2019 ,” Fitch said in a statement.
These, it said, were likely to have been driven by pressure from the Indian government to increase shareholder returns to shore up the weak fiscal position and finance promises made ahead of elections in April and May 2019.
“The higher shareholder returns will put more pressure on the financial profiles of the companies, which have large investment plans for the next two years,” Fitch said.
IOC and BPCL are in the process of upgrading and expanding their refineries to meet the deadline for producing ultra-clean Euro-VI grade fuel by April 2020, and improving downstream integration in petrochemicals. OIL plans to augment its domestic production and reserves.
In addition, BPCL and OIL are likely to invest in an upcoming Mozambique LNG project after a final investment decision on the project, which is expected in the second half of 2019, it said.
“OIL has limited headroom in its current standalone credit profile of ‘bbb-’, which may be revised down if weakening of its financial profile results in net leverage (adjusted net debt/operating EBITDAR) exceeding 2.5x. However, in such an event, OIL will benefit from one notch of support from the state, resulting in the final rating remaining unchanged at ‘BBB-’,” the rating agency said.
In comparison, IOC and BPCL have more headroom in their ‘bb+’ standalone credit profiles and are likely to remain resilient even in case of any modest weakening in their financial profiles.
The OMCs additionally face the risk of government intervention in fuel prices during the elections.
“However, Fitch does not foresee any significant impact on OMCs’ financial profiles on account of fuel price controls. We expect the OMCs to make up the losses in the subsequent period during the year in such an event,” the statement said.
Fitch said it believes OMCs will continue to revise prices daily to reflect the market prices over the medium term.
The ratings on IOC and BPCL are equalised with that of the state, in line with Fitch’s Government Related Entities Rating Criteria."
20,2019-05-17,IOC,"Oil marketers fall as prices gain on fourth day
Shares of oil marketers Indian Oil Corp Ltd, Hindustan Petroleum Corp Ltd and Bharat Petroleum Corp Ltd fell between 2 per cent and 2.5 per cent.
Oil prices rose for a fourth day, as rising tensions in the West Asia stoked fears of supply disruptions.
Brent crude futures rose 0.5 per cent from their last close. Indian Oil Corp fell as much as 2.3 per cent ahead of March-quarter results later in the day.
IOC was up 10.3 per cent, while HPCL has risen around 12 per cent this year, as of last close."
19,2019-07-14,IOC,"IOC hires foreign flagged VLCC at day rate of $31,950 for seven years


Earlier this year, IOC had called for bids to hire a ten-year old oil super tanker for a firm period of five years with two extensions of one year each
   -  KSL




Earlier this year, IOC had called for bids to hire a ten-year old oil super tanker for a firm period of five years with two extensions of one year each
   -  KSL


 Indian Oil Corporation Ltd (IOC) has hired a foreign flagged very large crude carrier (VLCC) at a day rate of $31,950 for seven years. This has upsetting the calculations of the Government to use such long-term contracts to help India expand its shipping capacity to haul more oil cargoes for strategic reasons.
Earlier this year, IOC had called for bids to hire a ten-year old oil super tanker for a firm period of five years with two extensions of one year each. This was the first of such experiments brokered by the shipping and oil ministries.
The move followed intense lobbying by the local shipping groups which said that long-term contracts would facilitate funding at better rates to buy ships.
Local fleet owners participating in the tender were given a so-called ‘right of first refusal’ to match the rate and take the contract if the lowest quotation was offered by a foreign owner.
The VLCC had to be fit with scrubbers when it begins the seven-year contract from January 2020, to comply with a global rule framed by the International Maritime Organization (IMO).
The country imported 84 per cent of its crude requirements in the last fiscal year and more than 90 pe cent of that were hauled on foreign flagged vessels. This entailed a foreign exchange outflow of freight worth billions of dollars.
Panama-flagged ‘Bright Pioneer’, a VLCC owned by Japanese ship owner Nissen Kaiun Co Ltd, had quoted the lowest day rate of $31,950 on the tender. Indian ship owners including the state-run Shipping Corporation of India Ltd (SCI) that had participated in the tender, however, declined to avail the right of first refusal and match the rate offered by ‘Bright Pioneer’, which they said were “too low”.
But, this argument lacked merit going by the weekly market rates published by Clarksons - the world’s biggest shipbroker- on Saturday. A five-year time charter for a modern VLCC currently fetches $26,250 a day for its owner, while a three-year deal earns $30,000 a day. The day rate for a one-year time charter is $34,000, according to Clarksons.
The Shipping Corporation of India had let its VLCC named ‘Desh Ujaala’ to IOC for six months beginning May/June. They had done so with two optional extensions of three months each (technically one year) at a day rate of about $22,100 when the market rate is $34,000 a day.
The only Indian link to the seven-year deal is that ‘Bright Pioneer’ is commercially operated by Singapore-based Global United Shipping Company founded by Captain Rajesh Unni. Global United Shipping is backed by Japanese trading group Mitsui & Co.
“IOC signed off on the deal to hire ‘Bright Pioneer’ a few days ago,” a person briefed on the contract said. Global United Shipping confirmed the development. 
Of the seven VLCCs run by Indian ship owners, only one – Desh Vibhor – run by SCI is less than 10 years old but is deployed on another contract. As a result, local owners had to first buy a ten-year old VLCC from the second-hand market and fit it with scrubbers to qualify. “Globally, most yards are booked fully for installing scrubbers that were ordered more than a year ago. Thus, ordering a scrubber and getting a yard slot to fit them by January next year has become impossible”, an industry official said. 
From January 1, 2020, ships must use fuel oil on board with a sulphur content of not more than 0.5 per cent mass/mass (m/m), a steep cut from the current global sulphur cap of 3.5 per cent m/m. Ships can meet the requirement by using low-sulphur compliant fuel oil or continue to use high sulphur fuel oil by fitting exhaust gas cleaning systems or scrubbers."
18,2019-08-02,IOC,"Oil India, Indian Oil, ONGC get new Directors, PGCIL gets new CMD


Representative image




Representative image


The Appointments Committee of Cabinet (ACC) has approved the proposals of the Ministry of Petroleum and Natural Gas and recommended Directors to the boards of Oil India, IndianOil and Oil and Natural Gas Corporation Limited.
According to the order dated August 1, Rajesh Kumar Srivastava has been appointed as the Director (Exploration) at ONGC. He was a Group General Manager at the company. In another order, Harish Madhav, Executive Director at OIL has been appointed to the post of Director (Finance), OIL.
The ACC has also appointed Sandeep Kumar Gupta, Executive Director at IndianOil to the post of Director (Finance) at IOCL.
In other orders, the ACC has approved the proposal from the Ministry of Power, and Kandikuppa Sreekant, Director (Finance) at Power Grid Corporation of India Limited has been appointed to the post of Chairman and Managing Director, PGCIL."
