,Date,Company,Article
15,2019-06-10,Maruti,"Auto sector on thin ice as slowdown persists


Representative image
   -  Bloomberg




Representative image
   -  Bloomberg


Plant shutdowns have become rather routine for automakers, with sales plummeting by the day and no signs of a reprieve in sight.
The first two months of this fiscal have seen sales in free-fall mode. Market leader Maruti Suzuki is reportedly contemplating cutting back on production in the coming weeks. Mahindra & Mahindra has already made its intent known in a communique saying it will go in for a closure of up to 13 days this quarter.
If the slowdown continues, more names could join the list. This is because companies will really have no reason to produce cars/two-wheelers and contribute to inventory pileups at dealerships.
Industry captains are hoping the Budget will bring in some positive news which could draw customers back to showrooms. For now, lending by NBFCs has virtually dried up, which means even interested buyers can’t access loans.








 
Automakers will be hoping that the GST on vehicles is brought down to 18 per cent from the existing 28 per cent, while the Centre will also do its bit to inject liquidity back into the system.
Manufacturers, meantime, are grappling with the pressure of material costs while working round the clock to get ready for the Bharat Stage VI (BS VI) emission norms, which kick off in April 2020.
The slowdown has caught the industry by surprise though it was getting apparent some months ago that demand in urban markets was drying up. This was reflected in falling sales though there was still some optimism that things would soon be back on track.
This was based on the assumption that there would be brisk buying of BS IV products which would be far more affordable than the BS VI options. After all, there are some pretty significant investments going into technology fitments for BS VI vehicles. This will translate into all vehicles becoming dearer.
It was this reality which possibly caused automakers to assume that this fiscal would see buoyant sales of the less expensive BS IV offerings.
The slowdown has caught everyone off-guard and manufacturers are now pretty much resigned to things not looking up till the end of the second quarter.
In the process, the supporting ecosystem, comprising ancillary suppliers and dealers, are also facing the pressure, especially when it means coughing up for overheads like labour costs and rentals. It’s hardly any surprise that dealerships are closing down while tier 2/3 suppliers are walking the tightrope between cutting back on BS IV production and investing in new lines for BS VI.
“It is a nightmare and we can only hope that there is some light at the end of the tunnel,” a supplier told BusinessLine. It’s only logical that following plant closures by their vehicle customers, vendors will also follow suit.
If a long slowdown occurs, things could get really tricky. “We don’t think this will happen and are hopeful that things will look up from October. We are already factoring slow sales for the April-June 2020 quarter, when customers will be lukewarm to expensive BS VI options,” said an industry official."
14,2019-06-21,Maruti,"Maruti Suzuki falls on price hike hints amid slowing demand 
Maruti Suzuki India's shares fall as much as 3.3 per cent to Rs 6,400.15 , its biggest intraday loss in over 4 weeks.
The automaker hinted at price increases across all variants of its Dzire cars, one of its top-selling models. The news comes at a time when Indian automakers are seeing a general slowdown in demand. Auto companies, including Maruti and Hero Motocorp, have cut production as inventories lay unsold
The car maker’s rival Tata Motors shares were also down over 2 per cent, dragging the Nifty auto index down 1.5 per cent.
Maruti shares were down 11.4 per cent this year as of last close."
13,2019-07-08,Maruti,"Auto stocks hammered, Maruti Suzuki shares at over 2-year low


The auto index is down as much as 3.51 per cent. File Photo
   -  The Hindu




The auto index is down as much as 3.51 per cent. File Photo
   -  The Hindu


Automaker Maruti Suzuki India Ltd tumbles 5.89 per cent, its lowest since March 31, 2017. About 1.5 million Maruti shares changed hands compared with the 30-day average of around 748,800 shares. The auto index is down as much as 3.51 per cent, its lowest in over three years.
On Friday, Finance Minister Nirmala Sitharaman, in the budget, lowered goods and services tax (GST) on electric vehicles to 5 per cent from 12 per cent and raised basic customs duty on automobile parts.
Meanwhile, India's biggest motorcycle maker Hero MotoCorp slips 6.06 per cent to its lowest since Sept 2015. Bajaj Auto Ltd's shares were down over 3 per cent and on track for their third consecutive session of declines.
Other losers include Motherson Sumi Systems, Ashok Leyland and Apollo Tyres, which were down in the range of 3.5 per cent to 4 per cent."
12,2019-07-21,Maruti,"Future Perfect: Consider calendar put-spread strategy on Maruti
The short-term outlook remained negative for Maruti Suzuki (₹5,768.9). The long-term outlook will turn positive only if Maruti Suzuki breaks ₹6,513 comfortably. If the stock maintains the current downtrend, it could reach ₹5,144, where it finds major support. A break below this level could trigger a heavy fall for Maruti Suzuki.
F&O pointers: Maruti Suzuki futures witnessed a rollover of 17 per cent to next month series. The August futures at ₹5,726.70 trades at a discount to the spot price. This was due to the dividend payout of ₹80 for which the company has fixed August 14 as ex-date, after which the August futures will revert to normal premium mode over the spot price. Option trading indicates a range of ₹5,600-6,000 for the stock.
 










 
Strategy: Shares could see instant movement once Maruti Suzuki’s quarterly results are declared on July 26.
As we see negative bias for the stock, traders can consider a calendar put-spread strategy on Maruti. This can be initiated by selling the current month ₹5,800-strike-put (₹90.05) and, simultaneously, buying the same strike August put (₹281.05). This strategy will cost traders ₹14,325 as the market lot is 75 shares.
The maximum loss would be the premium paid (₹14,325) and that will happen if the stock rises and closes above ₹5,800 in August.
Potential for profit will be very high, if the stock rises in the immediate term and falls from July 26 (next month series). Hold the position till the third week of August and exit if the loss mounts to ₹7,500 or at a profit ₹15,000.
Follow-up: Those who did not book profits when YES Bank surged may do so during the downside too."
11,2019-08-11,Maruti,"Maruti Suzuki bounces from a key base 
Here are answers to readers’ queries on the performance of their stock holdings.
I bought Maruti at around ₹8,000-8,500 levels. What is your opinion on this stock from a long-term perspective?
Jeevan
Maruti Suzuki India (₹6,101.2): The stock of Maruti Suzuki India has been in an intermediate-term downtrend since encountering a key resistance in the band between ₹9,700 and ₹10,000 in July 2018.
While trending down, the stock had decisively breached key supports at ₹8,500 and ₹6,500 in early July this year and continued to trend down. But a significant long-term support and a 50 per cent Fibonacci retracement level of the prior uptrend at ₹5,500 cushioned the stock.
Subsequently, the stock took support from the level and bounced up gaining 7 per cent accompanied by good volume last week.
Moreover, it formed a bullish engulfing candlestick pattern in the weekly chart, implying short-term trend reversal.
Also, the daily relative strength index and price rate of change indicator are displaying positive divergence, backing the trend reversal. There has been an increase in weekly volume over the past three weeks.
The on-going near-term rally can encounter resistance ahead at ₹6,500.
An emphatic break above this barrier will alter the short-term downtrend and take the stock up to ₹7,000 and ₹7,500 over the medium term. Inability to move beyond ₹7,500 can keep the stock consolidating sideways in a wide range between ₹5,500 and ₹7,500.
Key resistances above ₹7,500 are at ₹8,000 and ₹8,500. But a strong decline below the immediate support level of ₹5,500 will strengthen the downtrend and drag the stock down to ₹5,000 and ₹4,500 in the medium term. Such a fall will also be a threat to the long-term uptrend that has been in place since 2012.
Next key supports below ₹4,500 are placed at ₹4,000 and ₹3,400 levels. You can consider averaging in declines with a stop-loss at ₹5,400 levels and consider booking partial profit at ₹7,500 levels.
What are the short- and long-term prospects for the shares of Strides Pharma Science purchased at ₹486?
S Vanaja
Strides Pharma Science (₹422.1): The stock has been in a sideways consolidation phase in a wide range between ₹335 and ₹510 since May 2018.








 
The long-term trend is down for the stock. After testing the lower boundary of the sideways range in late July, the stock began to trend up. A strong tumble below ₹335 can drag the stock down to ₹300 and ₹260 over the medium to long term.
An emphatic break above the key short-term resistance level ahead at ₹450 can extend the current rally to ₹480 or ₹510 in the short to medium term. You can consider averaging the stock with a stop-loss at ₹335. A conclusive break above ₹510 will pave way for an up-move to ₹600 and ₹650 over the medium term.
Send your queries to techtrail@thehindu.co.in"
10,2019-08-23,Maruti,"MPV XL6 launched at Saboo RKS Motors
Saboo RKS Motors launched the MPV XL6 from its twin NEXA showrooms at Jubilee Kavuri Hills and Lumbini Gardens Secretariat here. Mayor Bonthu Rammohan Rao launched the vehicle in the presence of Saboo RKS’ CMD Vinay Saboo and Director Tanay Saboo and its customers. Vinay Saboo said the BS VI 1.5 litre smart hybrid Premium three row six seater comes with captain seats, stylish looks in Zeta and Alpha variants, both manual and auto transmission, with five colour options and is priced starting from₹9.79 lakh ex-showroom."
9,2019-08-29,Maruti,"Review: Maruti Suzuki XL6 - On predictable lines, yet promising


Maruti Suzuki XL6




Maruti Suzuki XL6


One of the strengths of car market leader Maruti Suzuki has been its ability to keep an ear to the ground. Notwithstanding, some of the recent pronouncements regarding the future of diesel cars, the general trend over the years has evidenced an uncanny ability to gather actionable market intelligence. 
But that was before the Indian car buyer morphed into a complex being infected with newer preferences and the choice of a whole new range of options. Of course, in the meantime, Maruti has also evolved into a brand that can make premium quality vehicles with a separate NEXA sales channel. The combination of the two evolutions is what the new XL6 is meant to represent."
8,2019-08-30,Maruti,"Priority is to improve fuel efficiency in petrol engines: Maruti Suzuki's CV Raman


CV Raman, Senior ED, Maruti Suzuki




CV Raman, Senior ED, Maruti Suzuki


As Maruti Suzuki gears up for a diesel-free BS VI era from its product portfolio next year, CV Raman, Senior Executive Director, Engineering, and his team are busy working on alternative fuel engines. A whole lot of new technologies are being tested at the Rohtak and Gurugram R&D centres. Raman discusses the fuel roadmap in an interview. Excerpts:
 
All the focus by R&D is on BS VI engines right now. By the end of this year or early 2020 (before March), we will have all our models BS VI-compliant. We have more than 50 variants in terms of petrol, CNG, manual/automatic transmission or AMT.
We have now carried out work for 50 per cent of the models and are now focussing on the balance. There are around 200 engineers entrusted with this responsibly from the overall pool of 1,800-odd we have in R&D. Since our centres in Rohtak and Gurugram cannot handle this on their own, we are using our suppliers’ outfits as well as test facilities of agencies like ICAT and ARAI.
As I just said, this is imperative because we just do not have enough time and space to upgrade all our models from a few centres. Hopefully we are able to meet all the requirements much before the new emission norms kick in from April 1, next year.
Our stance is that BS VI cost (for diesel) will be higher by ₹1-1.5 lakh vis-a-vis each petrol-driven car (industry standards). We will get to know more over the next six to eight months on the acceptance of diesel.
The point I am trying to drive home is whether there will be acceptability at that price level. Equally, it is important to see at what prices competitors will retail their diesel offerings. If certain segments require (diesel), we can certainly work on it.
However, the priority right now is to improve fuel efficiency in petrol engines. We will continue to work in this space where you will also see different levels of technologies emerging. We have smart hybrid and with our alliance with Toyota, we will work on strong hybrids too.
There is also CNG and this will gain momentum as the number of fuelling stations expand across the country. While we will do more localisation on CNG, we are also working with the Centre on methanol blends... R&D work is happening and we are evaluating engines.
It will require different dispensers. This is the main concern and we have to make sure that consumers are careful with its use. After all, the fuel is cheaper but it could end up damaging vehicles. To that extent, methanol is a different proposition.
Ethanol is easier in comparison. We have already made 10 per cent ethanol compliant (E10) and are now working with the Centre to explore the option of increasing this to 20 per cent. However, ethanol is not available across India. The blending levels are barely three to five per cent even though vehicles can meet up to 10 per cent. That is why we have requested the Centre to make it available across India and going beyond the regional-specific model at present.
We stopped auto LPG (in WagonR) because the price was pretty much at par with petrol. We are talking to companies like IndianOil for LPG dispensers. If that works out successfully and if there is also a fall in auto LPG costs, we could perhaps consider this for our vehicles.
The electric vehicle (EV) testing is happening and the key is to see if there is a business case economically. People in India can afford upwards of ₹1 lakh for petrol and diesel options but in the case of an EV, would anybody buy a ₹12 lakh car? If I were to ask anyone at what price they would like to buy an EV, the typical answer would be that it should ideally be ₹1 lakh more than a petrol car. And for an EV to operate and recoup the investments made, only a fleet model can work. This explains why the Centre has also realised this and is kicking off the electric journey with the fleet segment.
Of course, battery technology is an important aspect as well as creation of the right ecosystem for parts and charging infrastructure/grid management. It will be a new business model altogether, which means a mindset change is required.
Battery manufacturers are doing a whole lot of things the world over. The future may be solid state batteries and the challenge is that (battery) capacity is also limited. Let’s see how everything pans out.
It will be very difficult. This option is possible in buses and some of them are already operational on roads. However, it will be difficult when it comes to (private) ownership.
No, we will not look at such things. We are vehicle-makers and there are providers for battery charging who can offer the solutions. We are looking at this space only from a vehicle perspective.
The writer was in Jaipur at the invitation of Maruti Suzuki India"
7,2019-09-29,Maruti,"Consider a short strangle on Maruti Suzuki
The long term outlook for Maruti Suzuki India (₹6,773.1) remains positive, while in the short term, it will remain volatile. Only a close above ₹7,660 or below ₹5,480 will dictate a clear trend for the stock. Till then, Maruti will move in the range with a high bout of volatility. Short-term resistance and support appear at ₹7,010 and ₹5,970 respectively. A close above ₹7,660 could trigger a fresh rally in the stock and lift it towards ₹8,250. Similarly, a close below ₹5,480 could weaken the stock towards ₹4,990.
F&O pointers: The Maruti October futures contract witnessed a steady accumulation of open positions in the last two weeks. During the last series, it recovered from a low of ₹5,830.85 to ₹7,188.95 along with increase in open interests. This signals a positive bias, as traders are willing to hold on to the position. Option trading indicates a ₹6,000-7,500 range.
Strategy: Traders can consider a short strangle strategy on Maruti Suzuki. This can be initiated by simultaneously selling ₹7,600-call and ₹5,800-put. These options closed with a premium of ₹62 and ₹30 respectively. Traders will receive an initial inflow of ₹6,900, which is the maximum profit one can earn. For this to happen, Maruti has to move between the strike prices.
However, this strategy can result in heavy loss if the stock moves violently in any one direction — up or down. A close below ₹5,708 or above ₹7,692 will hurt the position. This strategy is strictly for traders who can withstand wild swings and have enough money to meet margin commitments.
Follow up: Hold ITC October call as recommended."
