,Date,Company,Article
67,2018-11-29,Maruti,"New Ertiga brings fresh appeal to MPV segment
The multi-purpose vehicle (MPV) segment is the most unglamourous in the Indian car market. But, with joint families being more the norm than the exception, almost every car buyer is tempted to consider one, usually as his or her second vehicle. However, most buyers loathe the dowdy, ‘fatherly’ image that MPVs and family vans, on average, tend to represent. Also, many MPVs run the risk of being considered people movers if they become popular amongst fleet operators and taxis.
The Toyota Innova and the Maruti Suzuki Ertiga are the only two MPVs that have managed to beat the image problem and have been popular in both the fleet or institutional buyer and the individual buyer segments. Many others have tried and have fallen by the wayside with negligible sales. Maruti is of course an old hand in the business of affordable MPVs, offering the Omni, the Versa and then the EECO in its line-up even before the Ertiga joined them. With changes in product driven by new regulations becoming inevitable, the focus has shifted towards the Ertiga, which too needs to evolve to adhere to the new safety and emissions rules.
The complete overhaul of the Ertiga for the 2019 model year is Maruti’s answer to an evolving market for MPVs. A sedan-like countenance and feature list, and additions like the K15 petrol engine from the Ciaz, as also the Smart Hybrid technology from the sedan make the new Ertiga seem very promising on paper. Does it feel equally interesting to drive, and should you hit the pause button on that sedan you’ve been eyeing and choose the new Ertiga instead?
The previous generation Ertiga, launched in 2012, looked a little ungainly, but its design was saved by the obvious carry-overs from the Swift. But, that still left it looking disproportionate and too focussed on practicality. The new gen Ertiga corrects that by adopting a completely fresh design language. Maruti’s vehicles have hardly been known to follow a family lineage design philosophy and the new gen Ertiga is one more example. An aggressive, youthful front profile has been attempted with the new sleeker, sedan-like headlamps that seem connected to the bonnet grille and the dual-tone, oversized fender with integrated airdam.
The new Ertiga has been built on the fifth generation Heartect platform just like the Swift. The new platform is lighter but more rigid and helps the Ertiga meet stricter crash safety norms for frontal offset and side impact, as also pedestrian protection regulations. The 2019 Ertiga has also grown in proportions; it is longer, taller and wider. But the new design manages to hide its larger size, especially at the rear, where the Volvo-like new vertical combination for the tail-lamps makes the Ertiga look more like a crossover than an MPV. Also abetting the deception is the floating roof concept created by a part of the C-pillar being covered by the large rear quarter glass merging into the tailgate just above the tail lamps (very much like in the Swift). Despite a fairly compact rear glass, the Ertiga still gets a big greenhouse thanks to large windows, which contribute to an airy cabin. The new Ertiga’s design has also led to the A-pillar becoming more angled with a mild reduction in the front blind-spot. Another highlight are the new 15-inch, multi-spoke alloy wheels (top-trim).
The new Ertiga’s cabin is a refreshing change compared to the outgoing model. It just feels so much cleaner, brighter and better finished than the previous generation. Again the finish quality and features of the cabin are a mix of sedan-like feel and practicality. The extra length for the new gen Ertiga, from the longer rear overhang, delivers more space in the cabin. This finally feels like a seven-seater, with the two reclining seats of the third row now being very usable even by small-made adults. The other seats are also better cushioned and bolstered, with the second row 60:40 seats also offering a 15-degree recline and fore and aft adjustments.






Safety standard: The new Ertiga gets a bunch of safety equipment as standard and the AT variants even get ESP and Hill Hold    -  S Muralidhar  
 
Safety standard: The new Ertiga gets a bunch of safety equipment as standard and the AT variants even get ESP and Hill Hold    -  S Muralidhar 
The cabin sports a dual tone theme with a mushroom grey and beige colour combination. There is an air of Suzuki about it, but that is still now a big plus. The cabin may not be luxurious, but it is still plush. The faux maple wood inserts, for example, are fake alright, but not obviously so. The leather-wrapped, flat bottomed steering wheel with wood insert is a bit much in an MPV, but it is so well finished and integrated that it fits. There are a number of small storage spaces in addition to the usual bottle holders and door pockets; of note is the duo of cooled cup holders in the centre console. The dashboard layout itself sports a simple, layered orientation with a very sedan-like position of controls and the 17.8-cm touchscreen infotainment system (in the top ZD+ trim). The instrument cluster is also an LCD multi-information screen that displays key info in a format very similar to other Nexa models like the S-Cross and Ciaz.
Before getting to the powertrains, a mention about Maruti Suzuki’s smart hybrid technology with the lithium-ion battery that has been carried forward into the Ertiga too after the Ciaz. The 2.5 kW electric motor, of what is effectively a mild hybrid, draws power from the dedicated battery to offer parallel assistance during acceleration. The system functions include brake energy regeneration, an idle start-stop function and torque assist to reduce load on the engine during different acceleration cycles.






The rear of the car gets a refreshed look  
 
The rear of the car gets a refreshed look 
The powertrain choices include the 1.5-litre K15 petrol engine in the same state of tune as in the Ciaz. The 1,462 cc engine produces 77 kW of peak power and 138 Nm of peak torque. It is offered with the option of a five-speed manual or a four-speed automatic (we have seen both these gearboxes in other Maruti cars). The four-Speed auto is a torque converter transmission, which has probably been picked up from the Japanese parent’s portfolio and it includes a low ‘L’ gear slot and a ‘2’ in second gear slot for high load conditions. The manual gearbox is a crisp, clean-shifting transmission that has a different set of ratios compared to the Ciaz, with taller lower gears. The engine itself is a good fit given the attempt at raising the bar for the Ertiga. It is refined, and even though it is not really a rev-happy unit, delivers a fairly healthy performance mid-range, which should suit most user profiles.
The other engine option is the tried and trusted DDiS 200 diesel engine. What is essentially the Fiat MultiJet engine, this 1,248 cc unit is still surprisingly sprightly for a vehicle that is as heavy as the Ertiga. Thankfully, the new generation despite its larger size is not heavier than the outgoing model and so the carried-over engine still feels torquey and quick off the block. The oil burner develops a peak power of 66 kW and a peak torque of 200 Nm starting from a low 1,750 rpm. This engine only gets the five-speed manual transmission, which seems adequate except when one is cruising at three-digit speeds and that makes you wonder if it should have had a sixth slot. It also gets the Smart Hybrid system.
The Ertiga’s ride quality was not much of a problem even for the previous generation, but the new one’s ride is even better. Very much like the new Swift, Baleno and the Ciaz, there is a feeling of sure-footedness and confidence about the suspension set-up that is heartening. It doesn’t trash about on bad roads and body roll is also quite well contained.
On the whole, the new Ertiga is a much better package than the outgoing model. It feels more plush and is also more practical with a few unique bits like the trays in the boot that hide a lower section and the cooled cupholders. Maruti’s variants strategy always seems to cut the ATs a bit short on features; that continues in the Ertiga. But there is still a good range of trim levels to choose from. Prices range from ₹7.44 lakh to ₹10.9 lakh."
66,2018-12-01,Maruti,"Maruti reports marginal decline in November sales at 1,53,539 units 


Representative image
   -  The Hindu




Representative image
   -  The Hindu


 India’s largest car maker Maruti Suzuki India reported marginal decline in sales at 1,53,539 units for the month of November.
 The company had sold 1,54,600 units in November 2017.
 Domestic sales were up marginally at 1,46,018 units last month as against 1,45,300 units in the year ago period, Maruti Suzuki India (MSI) said in a statement.
Sales of mini cars comprising Alto and WagonR stood at 29,954 units as compared to 38,204 units earlier, down 21.6 per cent.
 However, sales of compact segment models, including Swift, Celerio, Ignis, Baleno and Dzire, were up 10.8 per cent at 72,533 units as against 65,447 units in November last year, the company said.
 Mid-sized sedan Ciaz sold 3,838 units as compared to 4,009 units in the same month a year ago.
 Sales of utility vehicles, including Vitara Brezza, S-Cross and Ertiga, were up 1.9 per cent at 23,512 units as compared to 23,072 units in the year-ago month, MSI said.
 Exports in November were down by 19.1 per cent at 7,521 units as against 9,300 units in the corresponding month last year."
65,2018-12-06,Maruti,"Maruti Suzuki breaks support; chart suggests more downside
Shares of Maruti Suzuki India Ltd, the country's largest carmaker, fell as much as 4.48 per cent. The stock has broken a support at Rs 7,299.4. Support is identified as the 14.6 per cent Fibonacci projection level of the downtrend from the July 24 high to the October 31 low (wave A).
The stock's wave pattern suggests a five-wave downtrend (wave C) has started for the stock (continuation of the downtrend from the July 24 high to the October 31 low).
In the near term, some support is expected at Rs 6,990.8 and Rs 6,561.1, the 23.6 per cent projection level and the 50 per cent Fibonacci retracement level, respectively of the uptrend from the February 29, 2016 low to the July 24 high.
RSI has broken below the 50 level, which is seen as unfavourable. Maruti Suzuki stock was trading below its 20-, 50- and 200-day exponential moving average, a bearish sign. The stock had fallen 22.36 per cent this year as of last close, while the broader NSE index was up 2.39 per cent in the same period."
64,2018-12-10,Maruti,"Maruti drives past 5 lakh cumulative sales mark for CNG models 


Maruti introduced its first fleet of factory-fitted CNG vehicles in 2010. File Photo
   -  BusinessLine




Maruti introduced its first fleet of factory-fitted CNG vehicles in 2010. File Photo
   -  BusinessLine


 Auto major Maruti Suzuki India (MSI) on Monday said it has crossed cumulative sales milestone of five lakh CNG vehicles in the country. The company currently offers compressed natural gas (CNG) option in seven of its models, including Alto 800, Alto K10, WagonR and Celerio. Currently, WagonR is the highest selling CNG model in the Maruti Suzuki CNG portfolio.
MSI introduced its first fleet of factory-fitted CNG vehicles in 2010. “The benefit of low-cost of ownership comes along with environment friendly fuel option of CNG. The government’s resolve to rapidly expand countrywide CNG will enable many more customers to own an environment-friendly transport,” MSI MD and CEO Kenichi Ayukawa said in a statement.
MSI’s range of factory-fitted CNG vehicles are popular in Delhi NCR and across select cities in states of Gujarat, Maharashtra, Andhra Pradesh, Telangana, Odisha, UP and Punjab. In 2018-19, the company expanded its CNG vehicle availability to 26 new cities to reach over 150 cities across the country."
63,2018-12-13,Maruti,"Kia Motors, MG Motor debut at Autocar performance show 


FILE PHOTO




FILE PHOTO


 The 13th edition of the Autocar performance show commenced here Thursday, with two international brands - Kia Motors of Korea and MG Motor of the UK - showcasing some of their vehicle models on their debut at the four-day long event.
 While Kia has brought in the hot Stinger four-door and the Sportage SUV, the MG Motor has put up glimpse of its model line-up, a release said.
 The other automobile makers, who are displaying their car models include Lamborghini, Maserati, Porsche, Audi, BMW, Lexus, Volvo, Jeep, Skoda, Hyundai, BMW Mini, Renault, Honda, Maruti Suzuki Arena, Ford, Tata Motors, Mahindra & Mahindra, Nissan and Toyota.
 BMW Motorrad, Harley-Davidson, Ducati, Kawasaki, Triumph Motorcycles, TVS Motor, Suzuki Motorcycle India and Motoroyale Kinetic, are among the motorcycle makers participating in the show, it said.
 Another major attraction at this year’s show is the Supercar Gallery powered by Throttle97 (Mumbai’s largest supercar group), which will house models such as the Ferrari 488, Aston Martin DB11 and an Audi R8 V10, as well as Mahindra’s Formula E Season 5 race car the M5 Electro, among others, as per the release.
 Additionally, the 2018 show also brings in another first in the form of a two-wheeler dynamometer, it said, adding an estimated one lakh visitors are expected to throng the show over the course of four days."
62,2018-12-19,Maruti,"‘Taxing conventional cars to promote EVs will not serve purpose’


R C Bhargava, Chairman of Maruti Suzuki India Ltd
   -  File photo




R C Bhargava, Chairman of Maruti Suzuki India Ltd
   -  File photo


Maruti Suzuki Chairman R C Bhargava said that imposing cess on conventional vehicles to promote electric cars will not serve the purpose as only the rich would end up receiving subsidies.
Insisting that only cars should not be levied cess to promote electric vehicles (EVs), he also said two-wheelers, which consume two-thirds of petrol in the country, must not be left out in the electrification drive as these are much easier to be charged at homes.
“The biggest problem in India is the large number of small cars. Around 70 per cent of these cars could not be parked at homes and thus cannot be charged. I don’t think that small car electrification can happen on the basis of subsidies. We need technology for that,” Bhargava told reporters here.
The chairman of the country’s largest car maker was commenting on a report of a proposal to impose cess of Rs 500-Rs 25,000 on conventional vehicles to promote clean energy vehicles in the country.
Bhargava said all around the globe, including the US and Europe, electrification of cars has met with little success so far.
He said if a cess has to be there then two-wheelers also need to be taxed.
“If the principle is that a polluter pays then two-wheelers are also polluters. Why not a cess on two-wheelers also, so that the cess of petrol two-wheelers is utilised to subsidise electric two-wheelers,” Bhargava said.
Two-thirds of petrol in the country is consumed by two-wheelers, and electrification of two-wheelers becomes, so far, more practical in terms of infrastructure than electrification of cars, he added.
Bhargava stated that with 85-87 per cent car parc in India between now and 2030 set to be non electric cars, it is important to look at the problem in a holistic manner.
Parc refers to the total number of registered vehicles plying in the country.
“By then (2030), if you like to reduce oil import and pollution, what are your options? Your options are CNG, hybrid and biofuels. All these three technologies are required,” Bhargava said.
He said the better way to achieve target of having a lower fuel import bill and reduction in air pollution is by supporting CNG vehicles.
“If at all there is a cess on internal combustion vehicles, why not use this fund to build CNG infrastructure? It will happen quickly and give results quickly as well even with infrastructure shortage, sales of CNG cars have been going up,” Bhargava noted.
Bhargava also sought a lower goods and services tax for a hybrid vehicle which is an eco-friendly technology.
“EV is not the only technology. It is a means to an end and not an end in itself,” he said urging policy-makers to consider other technologies as well.
Commenting on the company’s plans, he said Maruti Suzuki India is looking to introduce a strong hybrid technology in its petrol cars that would help increase fuel efficiency by as much as 30 per cent.
The company would get the technology as part of the Toyota-Suzuki collaboration.
“By April 2020, when BS-VI emission norm is implemented, the cost of a diesel vehicle is expected to be around Rs 2.5 lakh more expensive than a petrol variant. Customers will then decide whether to go for diesel or petrol...our production will have to be naturally adjusted with customer demand,” he said."
61,2018-12-23,Maruti,"Maruti scouting for land in Haryana only to shift Gurgaon plant 


The company considers Haryana as its “mother State” and will scout for another location in the State only, considering the presence of its supplier base.
   -  Reuters




The company considers Haryana as its “mother State” and will scout for another location in the State only, considering the presence of its supplier base.
   -  Reuters


 Maruti Suzuki India (MSI) is seeking a land parcel of around 700 acres in Haryana for shifting its Gurgaon plant, a top company official said.
The company considers Haryana as its “mother State” and will scout for another location in the State only, considering the presence of its supplier base.
“Already, Manesar plant is spread across 700 acres so we are looking at a similar kind of land (for shifting Gurgaon plant),” MSI Managing Director and CEO Kenichi Ayukawa told PTI.
The company has not set any time line for shifting the plant and the focus right now is to locate a good land parcel, he added.
When asked if the company is looking to establish the new plant in Haryana itself, Ayukawa said: “First we have to discuss with the Haryana government ...because Haryana is our mother State... we have to focus in that area ... besides, we also have a lot of suppliers here ... we have to manage that also.” 
He added that so far the company has received a positive response from the Haryana government over the issue.
When asked to comment on the planned investment in the new plant, Ayukawa said it will depend on the production capacity which is yet to be decided.
MSI has been looking to shift its plant from Gurgaon due to congestion and traffic hassles. With the rapid development in Gurgaon, the company now finds its plant in the middle of a bustling city which has made it difficult for trucks carrying raw materials and finished products move in and out of the plant.
Besides Gurgaon, MSI has another manufacturing unit in Haryana at Manesar. Both Gurgaon and Manesar plants have a production capacity of 15.5 lakh units per annum.
Its parent Suzuki Motor Corp has also set up a facility in Gujarat. The first line with a capacity of 2.5 lakh units is in full production and the second one will be commissioned early next year.
Work has also started on the third line and the expected commissioning is early 2020. MSI is targeting annual production of 3 million units by 2025."
60,2018-12-24,Maruti,"Maruti Swift tops best-selling PV model list in November


According to SIAM data, Swift sold 22,191 units last month




According to SIAM data, Swift sold 22,191 units last month


 The country’s largest carmaker Maruti Suzuki India’s hatchback Swift emerged as the best-selling passenger vehicle (PV) model in November, pushing down the company’s entry level car Alto, which occupied the number one spot in the same month last year, to fourth position.
According to data by Society of Indian Automobile Manufacturers (SIAM), Swift sold 22,191 units last month as against 13,337 units in the year-ago month when it occupied the sixth spot in the best-selling PV model list.
Retaining the second place last month was MSI’s compact sedan Dzire with 21,037 units sold, albeit lesser number compared to 22,492 units in November last year. MSI’s premium hatchback Baleno also retained its third spot with 18,649 units. It had sold 17,769 units in November 2017.
The company’s entry-level small car Alto came in the fourth spot with 14,378 units sold in November as compared to 24,166 units in the same month last year, when it occupied the top spot. Another model from MSI’s stable, Vitara Brezza sold 14,378 units last month coming at the fifth spot, down from fourth position in November 2017 when it sold 14,458 units.
Completing a sweep of the top six spots for MSI was Wagon R with 11,311 units sold last month, down from fifth in November last year when it clocked 14,038 units. Hyundai Motor India Ltd’s (HMIL) premium hatchback Elite i20 sold 10,555 units in November coming at seventh position, up from eighth in the same month last year when it sold 10,236 units.
HMIL’s SUV Creta clocked 9,677 units to be at eighth position, moving up one slot from November last year when it registered 8,528 units.
Another compact car from the company’s stable, Grand i10 sold 9,252 units last month coming in at the ninth spot, down from seventh in the year-ago month when it sold 13,249 units. Making an entry into the top ten best selling PV models was HMIL’s comeback model Santro with 9,009 units. It was re-launched in October this year after it was discontinued in December 2014."
59,2018-12-25,Maruti,"Dzire overtakes Alto as best-selling PV model in Apr-Nov period 


FILE PHOTO
   -  REUTERS




FILE PHOTO
   -  REUTERS


Maruti Suzuki India’s compact sedan Dzire has become the best-selling passenger vehicle model in the domestic market during the April-November period this fiscal, overtaking the company’s small car Alto, according to SIAM data.
During the period, the company sold 1,82,139 units of Dzire as compared with 1,53,303 units sold in the year-ago period when it was in the second spot, according to the latest figures by the Society of Indian Automobile Manufacturers (SIAM). The firm sold 1,69,343 units of Alto in April-November period this fiscal as compared with 1,75,996 units sold in the corresponding period last year.
The third-best-selling car was the Maruti Suzuki Swift which clocked 1,60,897 units during the period. The model was in the fourth spot in the year-ago period with 1,15,192 units sold.
MSI sold 1,49,270 units of its premium hatchback Baleno in the first eight months of the ongoing fiscal, taking it to the fourth spot, dropping one position from last year when it sold 1,26,098 units in the comparable period.
The company’s compact SUV Vitara Brezza moved up to fifth spot with 1,09,247 units sold this year from seventh position in the year-ago period when it clocked 1,00,370 units.
WagonR, another model from MSI, was in the sixth position with 1,07,061 units, down from fifth last year when it registered 1,14,425 units.
Hyundai Motor India’s premium hatchback Elite i20 has sold 92,817 units in the April-November period this fiscal to be the seventh best selling PV model. It was in the eighth position in the year-ago period clocking 89,988 units.
The company’s compact car Grand i10 was at the eight position this year posting a sales of 88,016 units, down from its sixth position last year when it clocked 1,03,375 units.
HMIL’s SUV Creta has sold 84,701 units, retaining the ninth spot. It had sold 71,808 units in the year-ago period.
Completing the top-10 best-selling passenger vehicle model was MSI’s compact car Celerio with 70,079 units. It was at the same rank in the year-ago period with 66,682 units, according to the SIAM data."
58,2018-12-26,Maruti,"Maruti recalls 5,900 Super Carry units to fix faulty fuel filter


Maruti Suzuki India to inspect a possible defect in fuel filter of 5,900 Super Carry vehicles. File Photo
   -  PTI




Maruti Suzuki India to inspect a possible defect in fuel filter of 5,900 Super Carry vehicles. File Photo
   -  PTI


 The country’s largest carmaker Maruti Suzuki India (MSI) on Wednesday said it is recalling 5,900 units of its light commercial vehicle Super Carry to replace faulty fuel filter. The company will inspect a possible defect in fuel filter of 5,900 Super Carry vehicles manufactured between April 26, 2018, and August 1, 2018, MSI said in a regulatory filing.
The recall also includes vehicles in which fuel filter has been replaced in field during this period, it added. MSI dealers will start contacting owners of the suspected vehicles from Wednesday to inspect and replace faulty part free of cost, it said. Recall campaigns are undertaken globally to rectify faults that may potential be safety defects.
Earlier in October, MSI had announced recall of 640 units of Super Carry to fix a possible defect in the fuel pump supply. The recall covered Super Carry units manufactured between January 20 and July 14, 2018.
MSI rolls out Super Carry from its Gurugram facility. The vehicle comes equipped with a 793-cc diesel engine."
