,Date,Company,Article
62,2018-06-18,Tech Mahindra,"Most TechM exits ‘above project manager level’


Most of those who exited the company were rated ‘L’, which is the lowest of the three categories
   -  BusinessLine




Most of those who exited the company were rated ‘L’, which is the lowest of the three categories
   -  BusinessLine


  The country’s fifth-largest IT services company Tech Mahindra is learnt to have let go of about 1,500 employees for reasons ranging from poor performance to technology shifts. 
Multiple employees BusinessLine spoke to said that most of the exits have happened in the P1 Band, which is in the project manager and above levels. Most of those who exited the company were rated ‘L’, which is the lowest of the three categories. These employees were given two months severance pay with about 70 per cent of it being at the time of the resignation and the rest during the final settlement. 
A spokesperson for Tech Mahindra said the company has added 1,700 associates in the ongoing quarter. “Our endeavour is to build a digital workforce of the future. We will continue to focus on re-skilling and right skilling our employees to keep pace with the changing technologies and dynamic market needs. As a policy-driven company, We adhere to global standards and processes pertaining to our human resource,” the spokesperson said.
Zero tolerance policy
She said the company is deeply concerned with attempts at speculation and misrepresentation of facts in the media relating to their employees. “Tech Mahindra has zero tolerance policy on such matters, we are cognizant of our responsibilities and pledge to continue to create awareness among the masses regarding such falsehoods.”
But an affected employee told BusinessLine on the condition of anonymity as he feared that it will impact his final settlement: “On June 4, I was called for a discussion as a part of the appraisal process and they told me that my performance was not good. On June 7, I was informed that two months salary will be paid and I had to resign.” 
Interestingly, this employee claimed that he was rated “extraordinary” for two consecutive years in 2016 and 2017 and worked with clients such as BT and Orange. 
Tech Mahindra has 1.15 lakh employees and as an industry practice, around 3 per cent of the workforce is graded as poor performers. 
Another employee who works as a ‘Solution Architect’, said that he was shown the door after working in the company for a year.
 “I joined the company in 2017 from another top five software exporter with a lot of hope,” he said. 
When asked why they had asked him to leave, he said: “I was informed that my solution was not appreciated. This was not communicated to me at any point by either my manager or HR head,” he said, adding that he was just getting ready to get married when he was asked to leave. This employee was working on the AT&T account and also works in the P-band, which has employees with 7-8 years experience. He has, however, not resigned from the company so far. Another employee, who has been with the company since last 11 years, said he was consistently rated high and he had not been given any reason for the current poor rating. 
All these developments are coming at a time when Tech Mahindra, which in 2017 fiscal had revenues of $4.3 billion is undergoing transition, in an effort to keep pace with its peers in the industry. 
Last year, an HR official asked one of the employees of Tech Mahindra to submit the resignation by giving one-day notice. This audio conversation was leaked and went viral on social media. As result of this, Mahindra Group Executive Chairman, Anand Mahindra apologised on twitter. “I want to add my personal apology. Our core value is to preserve the dignity of the individual & we’ll ensure this does not happen in future,” he tweeted. 
‘Did Labour Dept know?’ 
The New Democratic Labour Front, which has taken up the cause of the affected employees of the company, told this paper that it wanted to know whether Anand Mahindra was aware of the developments at Tech Mahindra. “Don’t they know Industrial Disputes Act is applicable to IT employees and IT companies have to follow due process for any employment-related issues? Is this planned lay-off intimated to the Labour Department and permission obtained according to the law?,” a spokesperson for the Front said. 
The affected employees also pointed out that they were not put into a Performance Improvement Plan (PIP), which is a standard employee improvement performance plan, followed by the industry. But the company spokesperson said that a grievance cell has been set up for employees to seek counselling whenever they need. 
As some sections of employees grapple with their future, Tech Mahindra has been struggling to grow its revenues. 
In the 2018 fiscal, revenues grew by 5.6 per cent in 2018 fiscal, lower than Nasscom estimates of 7-8 per cent."
61,2018-07-04,Tech Mahindra,"TechM to set up Blockchain centre 
Tech Mahindra will also set up a Blockchain Centre within its research & development arm Makers Lab to facilitate co-innovation in the space, developing enterprise grade solutions for customers across industries globally.
Rajesh Dhuddu, Global Practice Leader, Blockchain of the company, said the Makers Lab will facilitate collaboration between academia, research and industry partners. He was here to launch the TechMBlockGeeks Programme in the Hyderabad campus today.
The company is targeting to train around 3,000 blockgeeks during fiscal 2018-19. It recently announced a partnership with blockchain technology pioneer ChromaWay to deliver blockchain technology to the Indian market.
Tech Mahindra has Makers Labs across four locations – at Pune, Chennai, Hyderabad and Bengaluru, besides labs in the US, the UK and Germany. They are involved in development work in technologies such as AI, machine learning, IoT, Robotics, 5G and network of the future."
60,2018-07-20,Tech Mahindra,"IT stocks gain as rupee hits record low
 IT stocks gained as rupee hit a record low. Shares of Indian IT firms rose with the Nifty IT index climbing 1.6 per cent, accounting for more than half of broader NSE index's gains.
The rupee today hit a record low of 69.13 per dollar, tracking weakness in yuan. The United States is the biggest market for Indian software services exporters.
Infosys Ltd and Tech Mahindra Ltd rose 3.4 per cent and 2.9 per cent, respectively. Tata Consultancy Services Ltd, the country's biggest IT co by market capitalisation, rose 0.84 per cent, while HCL Technologies Ltd climbed 2 per cent.
Wipro Ltd, which will report its June-quarter results later in the day, rose 1.7 per cent. Nifty IT index had gained 24.1 per cent this year as of last close, compared with the NSE index's 4.1 per cent rise."
59,2018-07-30,Tech Mahindra,"Tech Mahindra Q1 net rises 12% to ₹898 cr


CP Gurnani, MD & CEO, Tech Mahindra
   -  SHASHI ASHIWAL




CP Gurnani, MD & CEO, Tech Mahindra
   -  SHASHI ASHIWAL




IT services provider Tech Mahindra reported a 12.4 per cent increase in profit after tax as the company’s cost-cutting measures start to bear fruit. 
Net profit of ₹897.8 crore in the quarter ended June, a 12.4 per cent increase from the same period last year.
Revenue rose 12.8 per cent to ₹8,276 crore from ₹7,336 crore last year. Revenue in dollar terms was up 7.5 per cent from the same quarter last year to $1,224 million.
However, compared with the sequential quarter, revenue was marginally up at 2.8 per cent while profit after tax dropped 26.5 per cent. This was primarily attributed to the seasonal weakness in the company’s telecom business, led by a sharp decline at Comviva. Overall, the telecom revenues, which make up over 39 per cent of Tech Mahindra revenues, declined 6.5 per cent. CP Gurnani, Managing Director and Chief Executive Officer, Tech Mahindra, said. “The overall business growth trajectory for the FY19 is on track. While business seasonality has affected the current quarter, our Run Change Grow Strategy with strong focus on digital transformation is keeping the business buoyant. The changing demand landscape for next generation technologies is going to fuel the digital business further.”
Gurnani further said that he expects the telecom revenues to get back to growth with the help of new deal wins and momentum picking up for 5G services across the globe. 
Tech Mahindra said the results were also impacted by the wage hikes and investments made in future technologies. Overall, the company hired 745 new employees in the quarter, with 13 new active clients added.
The company also announced that Vice-Chairman Vineet Nayyar has decided to retire.
“I would like to thank Vineet Nayyar for his leadership, guidance and immense contribution towards Tech Mahindra’s journey as a global digital transformation leader for over a decade,” Gurnani said. “Although Vineet has decided to retire, he will continue to be our guiding force.”
He added, “I would also like to welcome on board our new Chief People Officer Harshvendra Soin.”"
58,2018-07-30,Tech Mahindra,"TechM delivers modest June quarter numbers 


Tech Mahindra delivered a modest set of numbers in the June quarter — a seasonally strong period for IT players — though the company’s financials were mostly in line with market expectations.
In the first quarter, Tech Mahindra’s revenues fell 1.6 per cent sequentially in dollar terms (up 0.3 per cent in constant currency). TCS (1.6 per cent), Infosys (0.9 per cent) and HCL Technologies (0.8 per cent) had reported higher revenue growth during the first quarter, while Wipro’s declined by 1.7 per cent.
EBIT (earnings before interest and tax) margin declined to 12.9 per cent (from 13.7 per cent in March) for Tech Mahindra.
The company’s largest vertical, communications (39.6 per cent of revenues), saw revenues decline. But manufacturing and BFSI segments expanded during the June quarter. While three customers were added in the $20 million bucket, there was no addition in the $10 million category.
Barring TCS, all other top-tier IT companies witnessed growth that was narrowly led and not broad-based across segments in the June quarter.
Attrition has been rising steadily for Tech Mahindra over the last three quarters and was at 19 per cent during the period.
Discount justified
Trade body Nasscom’s has projected a growth rate of 7-9 per cent in FY19 for the IT industry. With a modest performance in the June quarter, Tech Mahindra will have to up the revenue momentum in the second half to reach even the mid-point of the industry’s range. For the foreseeable future, it may continue to trade at a significant valuation discount to TCS and Infosys."
57,2018-07-31,Tech Mahindra,"TechM climbs over 4% on Q1 results


Shares of software services provider, Tech Mahindra Ltd, rose as much as 4.3 per cent to Rs 683.75 on strong Q1 results.




Shares of software services provider, Tech Mahindra Ltd, rose as much as 4.3 per cent to Rs 683.75 on strong Q1 results.


 Shares of software services provider, Tech Mahindra Ltd, rose as much as 4.3 per cent to Rs 683.75 on strong Q1 results.
The company had on Monday reported a 12.4 per cent increase in profit after tax as the cost-cutting measures start to bear fruit. Revenue rose 12.8 per cent to Rs 8,276 crore from Rs 7,336 crore last year. Revenue in dollar terms was up 7.5 per cent from the same quarter last year to $1,224 million.
Click here to read more
Investec says pace of deal wins implies that the long-awaited improvement in growth from telecom segment has begun. It has kept the rating unchanged at “buy” and a price target of Rs 786.
Jefferies has raised the rating to “hold” from “underperform” and price target to Rs 715 from Rs 625. It has raised constant currency growth estimate for FY19 slightly but has kept USD growth rate unchanged to factor in higher cross-currency headwind.
About 26 of 41 brokerages have rated the stock “buy” or higher, seven ”hold” and eight “sell” or lower; their median price target is Rs 747.50.
Around 4.4 million shares changed hands, 1.3 times their 30-day average. Up to Monday's close, Tech Mahindra stock had risen 30 per cent this year compared to Nifty IT index's 23.6 per cent gain.
(With inputs from Reuters)"
56,2018-08-03,Tech Mahindra,"Tech Mahindra inks pact with Telangana for “Blockchain district” 


Telangana State Information Technology, Electronics and Communication department (ITE&C) signed an MoU with Tech Mahindra to launch India’s first Blockchain district. FILE PHOTO
   -  The Hindu




Telangana State Information Technology, Electronics and Communication department (ITE&C) signed an MoU with Tech Mahindra to launch India’s first Blockchain district. FILE PHOTO
   -  The Hindu


 The Telangana State Information Technology, Electronics and Communication department (ITE&C) today signed an MoU with Tech Mahindra to launch India’s first Blockchain district here.
“It will be a centre of excellence, an incubator and process development for the emerging technology with innovative infrastructure and facilities to foster growth of Indian blockchain start-ups and companies,” said CP Gurnani, CEO and managing director of Tech Mahindra , at the International Blockchain Congress 2018 here.
Tech Mahindra as a founding member of the blockchain district will provide the platform and technology assistance to all the incubators in it, he said.
 Tech Mahindra will also empower accelerators to develop and solve market problems across its global customer ecosystem.
 Further, the Telengana ITE&C Department will provide regulatory and policy support to enable and promote Blockchain growth both in India and globally.
 The launch of the Blockchain district is a moment in history, he said adding it would be a global talent hub which can unlock the value of blockchain technology in democratising data and solving big scale world problems.
 “It is also a huge step in reskilling and right skilling the workforce of the future. Blockchain experts will be our crowning jewels as together we work towards making India the blockchain capital of the world,” he added.
 It will provide an opportunity for the blockchain ecosystem in India to collaborate and work towards building a blockchain district in Telangana and transforming India as the blockchain capital of the world, he said."
55,2018-08-22,Tech Mahindra,"Tech-M buys Czech engineering services firm Inter-Informatics


The acquisition will give Tech-M a highly skilled engineering team




The acquisition will give Tech-M a highly skilled engineering team




IT services firm Tech Mahindra will acquire Czech-based engineering services firm Inter-Informatics for €5.4 million (around ₹8 crore) through a wholly-owned subsidiary. 
“The investment committee of the board of directors of the company has approved the proposal to acquire 100 per cent shareholding on a fully diluted basis in Inter-Informatics,” the software services provider said in a BSE filing.
Access to East Europe
Inter-Informatics has a presence in the Czech Republic and Romania and had posted a revenue of $10.7 million in 2017. 
The acquisition could also provide Tech Mahindra access to the East European markets. Tech Mahindra will acquire Inter-Informatics through its subsidiary Mahindra Engineering Services Ltd (Europe).
New capability
“The enterprise value of the deal is €5.4 million. The deal will bolster company’s presence in the cabin engineering space and also provide a highly skilled engineering team focussed on the aerospace vertical,” the filing said.
Tech Mahindra is already building teams in Europe and the US to cater to specialised software deals that require direct customer interaction. 
Inorganic growth
The Pune-based firm is betting on acquisitions to grow in digital technologies as well as to gain access to newer markets. This is the third acquisition by Tech Mahindra in the last two years.
Earlier this year, the company bought a 17.5 per cent stake in the US telecom software firm Altiostar for $15 million. 
Last year, Tech-M bought US-based healthcare tech firm CJS Solutions Group to build its healthcare portfolio."
54,2018-09-11,Tech Mahindra,"‘At TechM, senior mocked me for being gay’
 Gaurav Probir Pramanik, who has faced bullying since childhood because of his sexual orientation, took to Twitter on Tuesday to talk about how he was mocked even at the workplace, while working for Tech Mahindra in 2015.
In a Twitter post, Pramanik alleged that Richa Gautam, the then global head of training at Tech Mahindra’s Business Services Group, constantly mocked the colour of his clothes and his “effeminate” behaviour. He said this was a key reason for his quitting the company three years ago. Pramanik claimed he had been mum since then as he was awaiting the Supreme Court verdict on Section 377. 
Pramanik posted screenshots of a letter he wrote to Richa, who headed the company’s Anti Sexual Harassment Committee, and was then Chief Diversity and Inclusivity Officer at Tech Mahindra, blaming her for constant attacks because of his sexual orientation. “I was constantly told that I was effeminate and that it affected my work. And since that was being done by the global head of training, who headed the company’s Anti Sexual Harassment Committee, I had nowhere else to report the incidents,” Pramanik told BusinessLine.
With the Supreme Court decriminalising gay sex by scrapping some provisions of Section 377 of the Indian Penal Code, questions have arisen about how corporate houses are dealing with gender diversity.
Pramanik, who was Asssistant Manager for Training, said the bullying had a cascading effect on the team’s culture. “As the top boss expressed so much hatred towards homosexuals, even the other team-mates started bullying me. It was turning into an organisation culture.” 
As Pramanik took to Twitter to share his trauma, M&M Chairman Anand Mahindra responded to him, promising prompt action. “I can categorically assure you that we celebrate diversity in our workplace. Our Code of Conduct is explicit on this subject...TechM is investigating these allegations, and appropriate action will follow...” Mahindra wrote.
Even CP Gurnani, CEO at Tech Mahindra, responded: “Gaurav, you have my personal assurance that this will be thoroughly investigated. We remain committed to supporting and promoting a diverse workforce at TechM.” Pramanik confirmed that he was approached by Tech Mahindra to initiate an inquiry. 
Experts believe that a diversity policy alone is inadequate to ensure a conducive work environment for sexual minorities. “Start-ups understand LGBTQ culture, but conventional companies, even in the tech world, treat it as taboo. Earlier, it was a clear barrier but since the Supreme Court judgåément, there’s a silent barrier. India is still living in the 18th century. It will take several years for the biases to change in the country. The Supreme Court verdict is just the stepping stone,” said Kris Lakshmikanth, CEO at The Head Hunters India."
53,2018-09-16,Tech Mahindra,"TechM sacks ‘diversity’ executive for ‘discrimination’ against ex-employee


The acquisition will give Tech-M a highly skilled engineering team




The acquisition will give Tech-M a highly skilled engineering team


Less than a week after former Tech Mahindra employee Gaurav Probir Pramanik spoke out against his homo-phobic supervisor, the company has sacked Richa Gautam, the global head of training at the IT services firm’s Business Services Group.
In a Twitter post, Pramanik had alleged that Gautam had constantly mocked the colour of his clothes and his “effeminate” behaviour. He said this was a key reason for his quitting the company three years ago.
“Arising out of an investigation carried out in the matter, the concerned employee has been separated from the employment of the company with immediate effect. At Tech Mahindra, we believe in diversity & inclusion & condemn discrimination of any kind in the workplace,” Tech Mahindra tweeted late Saturday night.
Gautam also headed the company’s Anti Sexual Harassment Committee, and was then Chief Diversity and Inclusivity Officer at Tech Mahindra.
“I stand vindicated,” Pramanik told BusinessLine, in response to Tech Mahindra’s prompt action.
However, , Pramanik was unhappy that he had not received a direct communication from Tech Mahindra. “I am not happy as such, since I haven’t received any official communication about it apart from the tweet.”
Pramanik says he still hopes he will get some form of direct communication from Tech Mahindra over his complaint last Monday. He had previously written to the global HR head about the issue, but had received no response.
However, last week, Mahindra Group Chairman Anand Mahindra personally intervened to help Pramanik secure redress. Mahindra responded to Pramanik’s complaint on Twitter assuring him of prompt action.
Addressing Pramanik directly, Mahindra had tweeted: “I can categorically assure you that we celebrate diversity in our workplace. Our Code of Conduct is explicit on this subject...TechM is investigating these allegations, and appropriate action will follow...”"
51,2018-09-30,Tech Mahindra,"Tech Mahindra wins Rs 350 cr enterprise business system deal from five major ports


The acquisition will give Tech-M a highly skilled engineering team




The acquisition will give Tech-M a highly skilled engineering team


Tech Mahindra will build and maintain an Enterprise Business System (EBS) to modernise and automate port processes for five central government-owned ports for Rs 350 crore including taxes in a first such outsourcing deal in the major ports.
Tech Mahindra won the contract on a tender issued by the Indian Ports Association (IPA) to build a common shared platform on behalf of Kolkata Port Trust, Paradip Port Trust, Chennai Port Trust, Mumbai Port Trust and Deendayal Port Trust (formerly Kandla Port Trust), the shipping ministry said.
The EBS is aimed at improving India’s ranking in ease of doing business, enabling faster request processing in delivery of services with better turnaround time, reduction in manual intervention/documentation required, reduction in overall transaction time and costs, improve the efficiency of port operations, quick turn round of vessels and subsequent less dwell time, dashboard to ports/ministry of shipping for real-time management information system (MIS) on cargo/ship movements and export-import (EXIM) transactions, simplified and accelerated procedures for cargo entry, exit or transit and enhanced transparency across systems.
The project implementation and stabilisation period is twenty months and operations and maintenance support is for five years.
Tech Mahindra will partner with SAP, Envision, CISCO, Dell and RTCom to roll-out the EBS for the five port trusts.
The proposed EBS will comprise three core solution components - port operations solution, standard ERP solutions and auxiliary solutions and would tightly integrate with the Port Community System (PCS) and other retained applications of ports, enterprise business standard processes and shared infrastructure on cloud, making it next generation modern system which will serve ports purpose in coming years.
The system would be driven by transparent, simple and error-free business processes, easily measured by clearly defined key performance indicators, use latest technology to achieve strategic business objectives and integrate seamlessly with prevalent systems and devices. The solution proposes a cafeteria approach for ports, which allows them to select the systems that they want to be implemented as per their needs. This model enables a minimal effort in a seamless manner if new ports opt to join the system in near future.
Other Central government ports such as Jawaharlal Nehru Port Trust, Cochin Port Trust, New Mangalore Port Trust, Mormugao Port Trust, V O Chidambaranar Port Trust, Visakhapatnam Port Trust and Kamarajar Port Ltd already run an enterprise resource planning (ERP) system which they built on their own.
An official with one of the port trusts said that the staff strength at major port trusts will reduce further as repetitive jobs will stop. The shipping ministry has frozen recruitment of workers at Class 3 level for more than a decade.
“Employee strength will come down further as repetitive jobs will get computerised. The beauty of ERP is that it gives end-to-end solutions as all departments will get integrated making information and data readily available resulting in easier decision-making,” the official said."
