,Date,Company,Article
9,2019-08-13,Tech Mahindra,"Aakash Educational Services collaborates with Tech Mahindra to enhance digitisation of operations


File photo
   -  P_V_SIVAKUMAR




File photo
   -  P_V_SIVAKUMAR




Aakash Educational Services Ltd (AESL) has entered into partnership with IT firm Tech Mahindra to manage digitisation of its operations including infrastructure, data centre and applications.
The three-year contract will provide support to AESL’s digital through which the company is planning to scale up its digital ecosystem and implement a complete automation model for digital support and maintenance.
“The option of online payment gateways will be another significant convenience for our users. AESL’s website will also be undergoing complete overhaul with latest digital solutions offered by Tech Mahindra,"" said Aakash Chaudhry, Co-Promoter and CEO of Aakash Educational Services Ltd. (AESL). 
A mobile app for students is also in the offing that will provide students all information pertaining to their attendance, fees, course etc. 
""Tech Mahindra’s proven expertise and wide array of digital solutions and offerings with help Aakash deliver superior connected experiences to its students,"" said Sujit Baksi, President, Corporate Affairs and Business Head APAC, Tech Mahindra,"
8,2019-08-18,Tech Mahindra,"Tech Mahindra sells 73.38% stake in arm to US-based Resolve Systems for $2 mn 


Telangana State Information Technology, Electronics and Communication department (ITE&C) signed an MoU with Tech Mahindra to launch India’s first Blockchain district. FILE PHOTO
   -  The Hindu




Telangana State Information Technology, Electronics and Communication department (ITE&C) signed an MoU with Tech Mahindra to launch India’s first Blockchain district. FILE PHOTO
   -  The Hindu


Software major Tech Mahindra on Sunday announced the divestment of 73.38 per cent stake in its subsidiary FixStream Networks Inc to US-based Resolve Systems LLC for $2 million (approx Rs 14.22 crore).
“...In terms of the authority delegated by the Board of Directors we wish to inform divestment of 73.38 per cent equity investment held by the company in FixStream Networks Inc, USA, a subsidiary company,” Tech Mahindra said in a BSE filing.
The company said consideration received from this divestment is $2 million for the equity held by the company, subject to necessary adjustments.
Tech Mahindra said FixStream Networks Inc reported a revenue of $5.15 million and a loss of $5.19 million in 2018-19.
The transaction is expected to be completed by November 15 this year, subject to receipt of all statutory approvals."
7,2019-08-23,Tech Mahindra,"Tech Mahindra partners with Qualcomm Technologies for smart city solutions 
IT company Tech Mahindra on Friday announced collaboration with Qualcomm Technologies, Inc to offer solutions for smart cities across the globe.
Under the partnership Tech Mahindra will integrate solutions from members of Qualcomm Smart Cities Accelerator Program.
“We are excited to partner with Qualcomm Technologies as part of their ‘Smart City Accelerator Program’ to ensure the development and deployment of cutting edge smart cities solutions globally,” Tech Mahindra President Communications Business Manish Vyas said in a statement.
The Qualcomm Smart Cities Accelerator Program members represent a breadth of hardware and software providers, cloud solution providers, system integrators, design and manufacturing companies, as well as companies offering end-to-end solutions with smart cities in mind, the statement said.
“The Qualcomm Smart Cities Accelerator Program provides a central hub for smart cities solutions across regions and verticals, and we are pleased to see Tech Mahindra participate as the leading system integrator in our program,” Sanjeet Pandit, senior director of business development and head of smart cities, Qualcomm Technologies, Inc said."
6,2019-09-13,Tech Mahindra,"Tech Mahindra to set up media innovation lab in Manchester 
 IT firm Tech Mahindra on Friday said that it is setting up a media innovation lab in Manchester, UK to develop next-generation solutions.
The lab will leverage Amazon Web Services (AWS) offerings and fuel co-innovation, targeting media customers in Manchester Media City and nearby regions, said a statement.
 The lab will help deliver qualitative content to end-customers quickly and monetise the value of content faster, it added. It will focus on future business models and underlying use cases focussing on millennials. The announcement was made on back of the International Broadcasting Convention 2019 (IBC)."
