,Date,Company,Article
59,2019-01-20,Wipro,"Wipro (₹346.2): Buy
The shares of Wirpo advanced almost 3 per cent accompanied by above average volume on Friday, breaking above a key medium-term resistance level of ₹340. Moreover, the stock surged 5.5 per cent with good volume last week, decisively breaking above a vital long-term resistance level of ₹330. This rally gives investors with a medium-term perspective an opportunity to buy the stock at current levels. 
The stock has been in a long-term uptrend since taking support at ₹205 in November 2016. Medium as well as short-term trends are also up for the stock. It trades well above its 50- and 200-day moving averages. There has been an increase in daily volume over the last one week. The daily relative strength index has entered the bullish zone from the neutral region. 
Similarly, the weekly RSI has entered the bullish zone from the neutral region, backing the continuing bullish momentum. Moreover, the daily as well as weekly price rate of change indicators hovers in the positive territory, implying buying interest. Overall, the medium-term outlook is bullish for Wipro. With the bullish momentum, the stock has the potential to trend up and reach the price targets of ₹370 and ₹380 over the medium term with a minor pause at ₹360. Investors with a medium-term perspective can buy the stock with a stop-loss at ₹328 levels.








(This recommendation is based on technical analysis. There is a risk of loss in trading)"
58,2019-01-22,Wipro,"Broker's call: Wipro (Buy)
Centrum Broking
Wipro (Buy)
CMP: ₹346.45
Target: ₹375
Wipro’s Q3FY19 revenues were in-line with our estimate. EBITDA margin, however, beat our estimate, resulting in PAT coming in 13 per cent higher than our estimates. Consolidated EBITDA margin for 3QFY19 was 21.9 per cent, up 220 bps and delivered a sharp beat (our estimate: 19.3 per cent). There is a reversal in provision for deferred contract cost. This alone helped swing EBITDA margin by 110 bps in Q3. Adjusted for this, EBITDA margin would have expanded 100 bps q-o-q. 
Wipro is showing steady acceleration in growth in select business units [BFSI (banking, financial services and insurance), Consumer and Energy & Utilities verticals]. Traction in top accounts also remains strong. While Wipro is yet to achieve full turnaround on an overall portfolio basis, we are encouraged by the green shoots. 
We see potential for revenue growth acceleration in FY20E led by scope for turnaround in performance of the remaining SBU’s (Healthcare, Technology verticals). Post 3Q margin beat, we raise our EPS estimates by 5/3/2.5 per cent for FY19E/FY20/FY21E to Rs20/22.7/25.0, respectively. Post 35 per cent rally over the past six months, Wipro trades at 15.3x FY20E EPS and 14x FY21E EPS. 
Resume coverage with a ‘buy’ rating and TP of ₹375 (15x FY21E EPS)."
57,2019-01-22,Wipro,"Businesses, govts must invest in reskilling workforce: Wipro CEO 


Wipro CEO Abidali Neemuchwala




Wipro CEO Abidali Neemuchwala


 Businesses and governments must invest in reskilling the workforce to address anxiety over impending job losses, Wipro CEO Abidali Neemuchwala said on Tuesday.
Speaking at a session here at the World Economic Forum’s annual meeting, he said businesses must also improve their ability to assimilate cultures.
To this end, Wipro is recruiting locally everywhere in the world, hiring as many people in the US, for instance, as it typically hires in India, he said.
By 2025, the fifth generation (5G) of mobile telephony technology will be rolled out in 110 countries, bringing unprecedented benefits for consumers, businesses and society, Ken Hu, Deputy Chairman and Rotating Chairman of Huawei Technologies, said at the same panel discussion.
In Globalization 4.0, “I believe there will be more focus from business benefit to social value,” Hu said, citing the potential of technology to make life better for people living with disability, provide more widespread access to banking services, and grow food for the expanding population.
Nokia Corporation CEO Rajeev Suri said evolving technologies will resolve the productivity paradox.
 Citing the example of the US, where the digital economy has enhanced productivity by 2.7 per cent per annum while the physical economy has grown by less than 1 per cent, he surmised that the “tipping point” for the US will be the year 2028.
 Four sectors -- health, transport, energy and manufacturing, which are underpinned by digital networks -- will unleash this wave of productivity, he said.
 Visa CEO Alfred F Kelly said customer and citizen centricity is imperative. For the first time in history, the size of the middle class is larger than the number of people in poverty, creating never-before possibilities for financial inclusion, Kelly said.
 “Financial inclusion comes after financial literacy. For this, education is necessary,” he added.
 Rebuilding trust has to be a collaborative effort by business and government, the panellists agreed.
 A coalition of government and business to develop good privacy and cybersecurity policies that can be applied across countries would be a defining moment, Suri said, adding that it is important to spread awareness of the benefits of Globalization 4.0 and 5G technology."
56,2019-01-23,Wipro,"Wipro hits near 19-year high; technicals suggest more upside
 Shares of software services provider Wipro Ltd gained as much as 1.95 per cent to Rs 353.25, their highest since February 23, 2000.
The stock broke above a resistance at Rs 348.22, the 61.8 per cent Fibonacci projection level of the uptrend from the June 6, 2018 low to the September 24, 2018 high (wave 1).
The breakout suggests that in a couple of days, the stock may rise to the next resistance at Rs 360.56, the 76.4 per cent projection level.
The stock's five-day average volume is 91.5 per cent higher than its 30-day average, suggesting volume is supporting price at higher levels.
The MACD is positive and above its signal line. The stock was up 7.58 per cent in the past one month as of Tuesday's close, while the broader NSE index was up 1.57 per cent."
55,2019-01-25,Wipro,"BFW, Wipro’s WIN Automation ink pact, to provide industrial automation solutions 


Bharat Fritz Werner Limited (BFW) a Bengaluru-based machining solution provider, has partnered with WIN Automation Solutions to offer customised modular, scalable and comprehensive factory automation solutions such as milling, turning and special purpose machines.
WIN Automation Solution is a business arm of Wipro Infrastructure Engineering (WIN), which caters to the industrial automation needs of manufacturing industries. 
“Both the companies will be offering solutions such as smart machines, intelligent material handling/automation systems synchronising the material flow to manufacturing/assembly needs, providing data analytics to maximise Overall Equipment Effectiveness (OEE), productivity, quality, inventories,” said Ravi Raghavan, Managing Director, BFW. 
“In sync with our purpose to ‘Enable Progress’ through solutions, we aim to comprehensively address the future of our clients by deploying digitisation. For this purpose, we will pursue a collaborative approach and partnership with WIN Automation, which is an important step in this journey,” he added.
Pratik Kumar, CEO, Wipro Infrastructure Engineering, said, “Industrial automation for manufacturing is a $150- billion opportunity globally and India is a nascent market. It is expected to grow exponentially. With WIN Automation Solutions, we are in the right place at the right time to capture this market opportunity.”
Indian Manufacturing is poised to grow exponentially to $1 trillion by 2025 and aims to propel India to rank within the top three economies of the world. 
To accomplish this, the manufacturing sector needs to overcome challenges related to productivity, competitiveness, flexibility and agility of response to a swiftly changing business environment. Seamless integration of material, information flow and digital environment with deployment of Industry 4.0-compliant solutions are key imperatives for companies in India and Asia."
54,2019-02-18,Wipro,"Wipro Kawasaki to double hydraulic products capacity


 Wipro Kawasaki, Precision Machinery inaugurated a hydraulic pumps and motors manufacturing plant for construction machinery.
Wipro Kawasaki is a joint venture between Wipro Infrastructure Engineering, which holds a 49 per cent stake, and Kawasaki with 51 per cent.
The facility, located in Bidadi will begin production in April 2019 doubling the company’scapacity to manufacture hydraulic products to 40,000 units a year.
Pratik Kumar, CEO, Wipro Infrastructure Engineering, said “Rapid growth in infrastructure in India is expected to drive the demand for construction machinery and the new facility helps us cater to the growing demand.”
Kawasaki can respond more flexibly to its customers’ varying production volumes, added Hidehiko Shimamura, General Manager Kawasaki Precision Machinery Division, Japan.
Overall domestic demand for construction machinery has been on the rise due to an expected growth in investment in local infrastructure, such as express ways, railway networks, and ports. With respect to the hydraulic excavator market, medium- to long-term growth is forecast, as annual demand is expected to reach 40,000 to 50,000 units in fiscal 2025. 
Following in the footsteps of China, India is also expected to achieve rapid growth in infrastructure investment.
Wipro Kawasaki first commenced production in December 2012 in a rented facility."
53,2019-02-24,Wipro,"Wipro shareholders approve bonus issue, increase in authorised share capital 


Wipro’s board had approved an issue of bonus shares wherein shareholders will get one bonus share for every three shares held by them. File photo
   -  Reuters




Wipro’s board had approved an issue of bonus shares wherein shareholders will get one bonus share for every three shares held by them. File photo
   -  Reuters


 Wipro on Sunday said it has received approval from majority of its shareholders for the issue of bonus shares and increase in authorised share capital.
 In January, Wipro’s board had approved an issue of bonus shares wherein shareholders will get one bonus share for every three shares held by them.
 In a regulatory filing, Wipro said the resolutions have been approved by members with requisite majority and shall be deemed to have been passed on February 22, 2019, being the last date of receipt of postal ballot forms/e-voting.
Consequently, the company’s authorised share capital stands increased from Rs 1,126.50 crore to Rs 2,526.50 crore by creation of additional 700 crore equity shares of Rs 2 each, it added.
 The filing said the 98.82 per cent votes cast were in favour of increasing the authorised share capital, and 99.81 per cent votes cast were in favour of offering bonus shares.
 In its January filing, Wipro had said the company had an aggregate amount of Rs 46,847.9 crore as on December 2018 in free reserves, securities premium account and capital redemption reserve account."
52,2019-02-27,Wipro,"Credit Suisse cuts rating, target on Wipro; shares fall 
Credit Suisse downgraded its rating on software services provider Wipro Ltd to ‘under-perform’ from ‘neutral’. It has also cut the company’s target price to Rs 320 from Rs 370.
The company’s shares, which is the top drag on NSE index, has fallen 2.4 per cent to Rs 378.2.
Credit Suisse analysts say while the margin recovery over the last few quarters was creditable, FY18 margins were at a 5-year low and the expansion this year has to be seen in that context. They also believe that there is limited scope for similar margin expansion in FY20 due to higher onsite costs and absence of currency kicker.
“Wipro deserves to trade at a reasonable discount to both Tata Consultancy Services and Infosys, given consistently slower growth rates and a lower (and more volatile) margin trajectory,” Credit Suisse said. “Wipro's sales engine has to become more effective so that the growth gap versus peers get bridged to some extent.”
The share closed at Rs 373.55, down Rs 13.65 (-3.53%) on the BSE, and at Rs 374.95, down Rs 12.70 on the NSE."
51,2019-02-27,Wipro,"Wipro divests two businesses for $110 million
Wipro has divested its Workday and Cornerstone businesses to Alight Solutions for $110 million.
India’s fourth largest software exporter had bagged a 10-year deal in 2018 from Alight Solutions for $1.5 billion. As a part of the deal —a first of its kind in the Indian IT sector — Wipro will divest both these businesses to Alight Solutions for cash of up to $110 million. Further, out of the $110 million, $100 million would be payable at closing of the deal and the balance $10 million would be a deferred consideration payable at the end of 12 months based on the achievement of performance targets, the company said in a statement.
The deal is expected to close during the quarter ending March 31, 2019.
“This agreement will enable Wipro to sharpen its focus on key offerings wherein it commands a leadership position. We will continue to make significant investments to grow our cloud applications and platforms business,” said Abidali Z. Neemuchwala, Chief Executive Officer and Executive Director, Wipro.
In 2016, Wipro acquired the Workday and Cornerstone OnDemand business as part of its Appirio buyout. Workday and Cornerstone OnDemand have multiple customers across the US, Europe, the Middle East and Africa, and Wipro has delivered 500 Workday engagements and around 3,000 Cornerstone OnDemand projects, the company said.
Wipro also said that it will continue to explore additional strategic opportunities and possible alignment of portfolios with Alight Solutions.
The divestiture agreement will also result in around 350 employees in both teams moving to Alight’s payrolls. The transaction will expand Alight’s capabilities and resources in HCM and financial solutions, with Wipro’s advisory, implementation and integration offerings, the company said.
Further, Wipro will also continue to support Workday’s suite of solutions for application management, testing and integration services for its existing client base. It will go ahead with its investment plans for the cloud applications and platforms space including growing and expanding its Salesforce business under the Appirio brand."
50,2019-03-01,Wipro,"Wipro shares to turn ex-bonus on Wednesday


Wipro will also continue to support Workday’s suite of solutions




Wipro will also continue to support Workday’s suite of solutions


Shares of Wipro will turn ex-bonus on Wednesday, as the infotech major has fixed March 7 as the record date to determine eligible shareholders for the bonus shares. Wipro had recommended an issue of bonus shares in the ratio of one equity share for every three equity shares held. The stock will remain in focus, as investors wishing to receive the bonus shares need to own Wipro shares by Tuesday. Currently, 2.59 lakh small investors hold 1.85 per cent stake in Wipro."
49,2019-03-06,Wipro,"Top five news stories to watch out for on March 7, 2019
Railway Minister Piyush Goyal is likely to hold a marathon meeting of senior officials on March 7 to prepare a roadmap for the future of the national transporter. Days before the Model Code of Conduct comes into force, Goyal will conduct a final assessment of the work done by his ministry over the last five years.
Rahul Gandhi will address a rally at Moga, Punjab, today. He will launch a debt-relief scheme for farm labourers and landless farmers which was approved by the State cabinet. He is expected to talk about the distress faced by the farmers and might take on the Prime Minister on the events leading to and the aftermath of the Balakot air-strikes. He is will also attend a rally in Himachal on the same day.
The Wipro board of directors is expected to meet today to announce the criteria for bonus to eligible shareholders. Earlier, it issued a 1:3 bonus, that is one equity share for every three fully paid-up equity shares held, and one American Depository Share for every three ADS held. Nearly 2.59 lakh small investors hold 1.85 per cent stake in Wipro.
Honda will launch its India-specific Civic today as the carmaker looks to take on Toyota Corolla Altis, Skoda Octavia and Hyundai Elantra and others. Just like its predecessor, the 10th generation Civic is powered by the same 1.8-litre petrol engine, but it comes with a semi-automatic, 7-speed transmission with paddle shifters as the only transmission option. The new 1.5-litre diesel variant will have an optional 6-speed manual transmission.
The European Central Bank (ECB) will announce its rate decision today. While analysts believe that the ECB is unlikely to change the rates, the markets are hoping for another doze of stimulus ahead of the ECB’s meet."
48,2019-03-08,Wipro,"Wipro sinks on stake-sale by Premji Trust


Azim Premji. File photo
   -  PTI




Azim Premji. File photo
   -  PTI


Azim Premji Trust has sold 2.66 crore shares of Wipro in a block deal.
India’s third-largest software exporter sold 2.66 crore shares or 0.44 per cent of the share capital of Wipro, the software major said in a filing to the exchanges. Azim Premji Trust is part of the promoter group that held 336.19 crore shares amounting to 74.30 per cent stake in the company as of the quarter ended December 31, 2018. 
On March 7, Azim Premji Trust had sought pre-clearance for selling equity shares of the company and was granted permission for the proposal on the same day, the filing added. Securities and Exchange Board of India (SEBI) regulations mandate pre-clearance from companies for selling their equity shares.
According to bulk deal data with the Bombay Stock Exchange (BSE), Wipro sold these shares at an average price of ₹256.58 a share. This translates into a deal size of about ₹682 crore. However, the identity of buyer/s is not known immediately. 
This development also needs to be seen in the backdrop of Wipro seeking a nod from SEBI to make a third consecutive buyback offer. Wipro had to get SEBI’s nod as it is in the middle of a scheme of amalgamation of its four-wholly owned subsidiaries with itself. SEBI rules mandate that firms cannot go for a buyback offer when an amalgamation is pending. Currently, the scheme is pending approval at the National Company Law Tribunal (NCLT). Wipro sought a waiver as there is a backlog of cases at NCLT.
In a statement to the exchanges, Wipro added that it will make necessary disclosures to the stock exchanges as required under the SEBI Insider Trading Regulations, within the prescribed timelines. Wipro also clarified that the sale of shares is an independent transaction undertaken by the Azim Premji Trust. Azim Premji Trust, along with other promoter entities, has sold its 2.73 per cent stake in Wipro for more than ₹5,700 crore in the recently-concluded buyback offer.
Shares of Wipro closed at ₹256.5, down 4.58 per cent, on the BSE"
47,2019-03-13,Wipro,"Premji commits additional 34% stake worth $7.5 b for philanthropy


Azim Premji, Chairman, Azim Premji Foundation
   -  THE HINDU




Azim Premji, Chairman, Azim Premji Foundation
   -  THE HINDU


Wipro Chairman Azim Premji has committed to philanthropy an additional 34 per cent stake in Wipro Ltd belonging to him and valued at ₹52,750 crore ($7.5 billion).
The new commitment is in addition to the 33 per cent Premji had already earmarked for the Azim Premji Foundation, taking the total market value of the philanthropic endowment corpus to ₹1,45,000 crore ($21 billion).
Premji’s total stake in Wipro stands at 74.3 per cent. With the additional commitment, the Foundation now has economic ownership of 67 per cent of Wipro.
What this means is that all the dividends, bonus and other benefits that accrue to the 67 per cent stake will go towards the endowment that supports Premji Foundation’s philanthropic activities.
“Azim Premji, Chairman of Azim Premji Foundation, has announced that he has increased his commitment to philanthropy by irrevocably renouncing more of his personal assets and earmarking them to the endowment that supports the Foundation’s philanthropic activities.
He has done this by additionally earmarking all economic benefits for philanthropic purposes in approximately 34 per cent of the shares in Wipro Ltd currently valued at ₹52,750 crore ($7.5 billion) held by certain entities controlled by him,” a statement from the Foundation said on Wednesday.
Premji’s earlier donations to philanthropy included Wipro’s shares as well as other assets owned by him.
Over the past three years, Premji, through his entities, earned ₹10,115 crore through dividends and share-buybacks from his entire stake in Wipro.
According to the Hurun India Philanthropy List 2018, Premji and his family contributed ₹113 crore last year. Mukesh Ambani topped the list with contributions worth ₹437 crore, followed by Ajay Piramal and family’s ₹200-crore contribution.
Established in 2001, the Azim Premji Foundation works mainly in the area of primary education and supports other not-for-profits working in specific areas through multi-year financial grants.
The Foundation’s extensive fieldwork in education with close partnership with various State governments helps contribute to the improvement of quality and equity of the public schooling system. Its field strategy focusses on scaling up a network of institutions at the district and State levels, to contribute to improvement in the school education system on a continued and sustained basis, the statement said.
The Foundation has also set up the Azim Premji University in Bengaluru that offers various degree programmes and opportunities to conduct research in several fields of human development and social importance.
Over the next several years, the activities of the Foundation are expected to scale up significantly.
The team driving the field work in education is expected to grow significantly from the current 1,600 people, while the university will have 5,000 students with 400 faculty members across multiple programmes. Thereafter, another university in the North may be set up.
The grant-making activities will also continue to expand rapidly, growing three times from its current levels, supporting work across multiple domains of social importance in India, said the statement.
Of Premji’s 74.3 per cent stake in Wipro, 67% is committed to the endowment that supports Premji Foundation’s philanthropic activities. This means all the dividends, bonus and other benefits that accrue to the 67 per cent stake will go towards the endowment
The Foundation works with various State governments to improve the quality and equity of the public schooling system
It also runs the Azim Premji University in Bengaluru"
46,2019-03-15,Wipro,"Wipro launches third global IIoT lab in Kochi 


Wipro (file photo)




Wipro (file photo)


 Wipro has launched an Industrial Internet of Things (IIoT) Centre of Excellence in Kochi to develop solutions for customers in industrial manufacturing, automotive, healthcare and pharmaceutical, consumer products and goods and utilities sectors. 
The lab will leverage artificial intelligence, blockchain and robotics to develop Proofs of Concept and market-ready IoT solutions in an iterative agile development model, a company spokesman said. 
M Sivasankar, IT Secretary, Kerala, who inaugurated the centre, said that Kerala has focussed on technologies that are critical to the ‘Industry 4.0’ concept of which IoT is an integral part. 
Looking to address skill-related issues in emerging technology areas including IIoT, the State is fostering a vibrant hardware-based start-up ecosystem and a skilling framework that connects technical institutions. 
The rollout of the Kerala Fibre Optic Network (KFON), a fibre2home/enterprise/institution network, in the next 18 months will help local economy stakeholders benefit from IIoT deployments. “So, Wipro’s decision to set up its third global IIoT lab in Kerala is a timely one and I hope it grows into a major development centre in a short period of time.”
Earlier, Wipro had hosted a two-day hackathon on Industrial IoT at its Kochi development centre, which saw active participation from leading engineering colleges in Kerala. 
The company will extend pre-placement offers to winning participants in the final year of their engineering degree course while those in the penultimate year of their degree programme will receive internship opportunities. The new hires will join Wipro’s IIoT research and development team in Kochi.
Jayraj Nair, Vice President & Global Head - IoT, Wipro, said that the Industrial IoT Centre of Excellence in Kerala is the third such centre after Mountain View, California, and Bengaluru. 
“Over the years, Kerala has grown into a technology hub that offers access to a dynamic talent pool with an aptitude for new-age technologies,” he said. “IoT presents a huge opportunity for industries in a hyper-connected world and we are confident that our services and offerings will help clients leverage IoT as part of their digital transformation goals.”"
