,Date,Company,Article
17,2019-08-28,Wipro,"Soap makers reduce prices to boost sales 
 Leading soap manufacturers have slashed prices on their products following lower palm oil prices to tackle muted growth in the sector.
 Hindustan Unilever Ltd (HUL) has reduced the prices of its popular soap brands– Lux and Lifebuoy – last month.
 “HUL does selective and judicious price changes across its portfolio in the normal course of its business. Given that the commodity prices are expected to remain benign for certain time period, we have taken price reductions in range of 4 per cent to 6 per cent in Lux and Lifebuoy portfolio, while it may be higher on certain packs in order to pass on the benefits to the consumers,” HUL said in a statement.
 Wipro Consumer Care, makers of Santoor soap, has also slashed the prices.
 “...we have also cut prices in soaps, passing on the benefit of lower raw material prices to the consumer. We believe this will help increase consumption,” said Wipro Consumer Care president (India consumer care business) Anil Chugh.
 Kolkata-based multi-conglomerate ITC also cut prices due to lower raw material cost about 5-6 weeks back.
 “ITC passed on the benefit of lower raw material costs to consumers through a downward revision in prices about 5-6 weeks back in certain packs of its soap variants,” said an ITC spokesperson.
 Data analytics firm Nielsen, in a report, had last month said that in April-June quarter, sales of FMCG items, including soaps, have slowed down.
 “... this quarter has witnessed a slowdown across all food as well as non-food categories with Salty Snacks, Biscuits, Spices, Toilet Soaps, and Packaged tea leading the slowdown,” Nielsen had said."
16,2019-09-04,Wipro,"Shareholder settles case with SEBI in Wipro matter 
 Markets regulator SEBI has settled a case with an individual for alleged delay in making requisite disclosures regarding her shareholding in Wipro.
The watchdog has settled the matter with one Kumudha Sridharan on payment of a little over Rs 5 lakh towards settlement charges.
A SEBI probe had prima facie revealed that Kumudha Sridharan had on two occasions delayed making the disclosures as required under the PIT (Prohibition of Insider Trading) norms with respect to change in her shareholding in Wipro.
Kumudha Sridharan had approached SEBI to settle the case “without admitting or denying the findings of fact and conclusions of law”.
 “The proposed proceedings that could have been initiated for the defaults ... are settled qua the applicant (Sridharan),” the regulator said in an order dated August 30.
SEBI noted that it would have the right to take enforcement actions, if it finds that any representation made by the applicant is subsequently discovered to be untrue."
15,2019-09-04,Wipro,"Wipro bags $300-million deal from ICICI Bank 
 Wipro Ltd has secured a strategic seven-year engagement, valued at $300 million, from ICICI Bank to provide a comprehensive suite of services. 
“This engagement will further strengthen our endeavour to provide differentiated technology and digital capabilities to the financial services industry,” a Wipro statement said.
Currently, IT services company Vara lnfotech provides these services to ICICI Bank. As part of the latest deal, Wipro will absorb about 3,800 employees of Vara lnfotech along with its existing contracts, facilities and assets, on a going-concern basis, through a business transfer agreement for an all-cash consideration of ₹321 crore. 
The revenue generated by this business in FY19 stood at ₹221.5 crore, said Wipro. The latest transaction is expected to be completed during the quarter ending September 30, and is subject to customary closing conditions, it added."
14,2019-09-05,Wipro,"‘No big deal’: Analysts not warm to Wipro-ICICI Bank deal
Analysts said that while Wipro’s $300-million deal with ICICI Bank is a large deal, it is still a low profitability business. 
Wipro on Wednesday announced a seven-year deal with ICICI Bank for a total contract value of $300 million. The deal is expected to start delivering revenues from this month itself. As part of this strategic engagement, Wipro will absorb about 3,800 employees of Vara lnfotech along with its existing contracts, facilities and assets. 
“We see this deal to be similar to the people takeover deals that have gained prominence in the sector over the recent years. It provides revenue visibility of 0.2 per cent of Wipro’s FY20E revenues and 0.4 per cent bps on annualised basis,” said Emkay global in a note to investors.
It said that while margin details have not been shared, the margins for this business will certainly be dilutive to Wipro’s native IT Services margins, given the low revenue productivity of Vara lnfotech’s business ($8.3k for Vara vs $47.3k for Wipro). Vara Infotech had revenues of ₹200 crore in FY19. Vara Infotech used to provide BPO, App Services and Infra support to ICICI bank. 
Wipro plans to leverage its Automation platform Wipro Holmes to derive synergies out of this deal. “We believe that Wipro’s relative under performance is here to stay in FY20E as sectoral weakness can possibly drive a growth moderation in its Financial Services vertical, where the company did well in FY19 (up 16 per cent YoY in CC terms). Wipro’s large buybacks (7 per cent in FY18 and 5.5 per cent in FY19) have so far supported its stock price.
HDFC Securities in its note said that Wipro is struggling to grow whereas larger peers are clocking double-digit growth rate. BFSI, which was the key revenue driver for Wipro is in slowdown. Issues such as completion of large projects (consumer), delay in decision making (BFSI, Manufacturing) and deferral in ramp-up of large projects is impacting growth. 
The guidance for Q2 in FY20 indicates that the lag is entrenched. Margin expansion is difficult and the buyback trade is over. Wipro has underperformed in the last three months (-8 per cent vs NIFTY IT -3 per cent) and the trend will continue unless growth revives, the note said. 
BOB Capital Markets in its note said that despite several strategic interventions, Wipro has underperformed its tier-I IT service peers in terms of revenues and earnings over the past seven years. Regulatory uncertainty for the healthcare business, restructuring of India and Middle East operations, and a muted outlook for the BFSI and manufacturing verticals cloud recovery prospects.
Wipro’s shares were flat at ₹255.55 at the close of trading on Thursday."
11,2019-09-20,Wipro,"Wipro Consumer Care sets up a venture fund to invest in start-ups 


Wipro Consumer Care and Lighting has launched Wipro Consumer Care - Ventures.
This initiative will invest in innovative start-ups in the consumer brands space. The venture will focus on companies with a differentiated approach where both parties can learn by leveraging their strengths and add value to each other.
To kick-start this, Wipro Consumer Care has appointed Sumit Keshan, a former Wiproite, as the Managing Partner of the Ventures. “Our investment in Happily Unmarried was our first step to establishing this venture capital fund. Apart from financial capital, what we bring to the table is deep knowledge of operations and the ability to scale up, and a strong understanding of consumers in India and South East Asia markets. These would support start-ups in their endeavour to grow rapidly”, said Sumit Keshan, Managing Partner, Wipro Consumer Care - Ventures.
Within consumer brands business, the primary area of focus would be categories that are of interest to the company. It operate mainly in personal care, skin care, home care, and lighting categories. The company intends to invest in new-age start-ups in digital, e-commerce, and other ventures that adopt an innovative approach to reach consumers. It will invest in companies in India and south-east Asia that have active entrepreneurs and a sound business model.
The company has had significant learning of digital and e-commerce space across geographies like India, Indonesia, China, Malaysia, and Vietnam. In 2017, the company invested in Happily Unmarried in India, which markets the men’s and women’s grooming products under the brands Ustraa and Happily Unmarried, respectively."
