,Date,Company,Article
101,2018-03-14,Wipro,"Wipro Infra launches 3D printing centre in Bengaluru


Pratik Kumar, CEO, Wipro Infrastructure Engineering




Pratik Kumar, CEO, Wipro Infrastructure Engineering


Wipro3D, the additive manufacturing arm of Wipro Infrastructure Engineering, has launched an experience centre for metal 3D printing here. The solutions developed in the centre will be taken to markets across the world.
Launched by the company’s billionaire Chairman Azim Premji, the 12,000 sq ft centre has capabilities such as post-processing, research, characterisation and validation for metal additive manufacturing. 3D printing is a process through which materials are added or solidified to create a 3D object.
Pratik Kumar, CEO, Wipro Infrastructure Engineering, said that based on the confidence developed from its India operations, there are plans to take Wipro3D global.
Established in 2012, Wipro3D has developed a range of end-use applications, and offers additive manufacturing solutions, products and services to industries such as automotive, aerospace, industrial, healthcare, heavy engineering and oil & gas.
For instance, it works with medical device or tools designers and manufacturers, as well as surgeons, to identify the need for special surgical tools and improve the functionality of the component. Surgical devices, neonatal support systems, blood transfusion systems and components of imaging equipment are some examples where additive manufacturing can play a key role.
Similarly, in aerospace, Wipro Infrastructure has a partnership with Israel Aerospace Industries. In 2016, it acquired HR Givon, an Israel-headquartered manufacturer of metallic parts and assemblies for the aerospace industry, which has three manufacturing plants — two in Israel and one in the US.
With its additive engineering expertise, Wipro is able to offer design inputs working with customer’s domain experts that can result in significant improvement in functional effectiveness and ease of use, company executives said. “We see 3D printing or additive manufacturing as a critical component in the digital manufacturing and future proofing strategy of any enterprise,” said Ajay Parikh, Business Head, Wipro3D.
Manufacturing companies are increasingly starting to adopt 3D printing, as they see cost as well as innovation benefits. According to Ritesh Gandotra, Director, Global Document Outsourcing, Xerox India, and Balaji Rajagopalan, Executive Director - Technology, Channels & International Distributor Operations, Xerox India, the rise of 3D printing is likely to lead to reinvention of many old products, as well as the introduction of extraordinary new innovations."
100,2018-03-14,Wipro,"Wipro to divest hosted data centre services business to Ensono for $405 million
 Wipro will divest its hosted data centre services business to Ensono, an IT services provider, for $405 million, as it seeks to increase its focus on digital.
Further, Wipro and Ensono have also signed a long-term partnership agreement to jointly address the IT requirements of Wipro’s new and existing enterprise customers. As part of the agreement, Wipro will make an investment of $55 million in Ensono’s combined entity. Ensono is a portfolio company of Charlesbank Capital Partners and M/C Partners.
This helps Wipro in unlocking value by transitioning eight data centres and around 900 employees of its hosted data centre services business to Ensono. For Ensono, the acquisition significantly expands its geographic footprint and global service capabilities.
For large and mid-size enterprises, Wipro operates centres globally for over two decades and the hosted data centre services business is one of the three businesses that became a part of Wipro when it acquired Infocrossing in 2007, an acquisition that seems to have not yielded good returns due to increased automation and advances made by cloud computing. 
However, the company clarified that the other two businesses involving medicare and medicaid services in the US health insurance space and ERP implementation services have been integrated with other Wipro businesses and are not part of this divestment. 
“As we embrace our strategy of focussing on newer digital areas of spend, our strategic investment and partnership with Ensono will enable us to continue meeting the hosted data centre services requirements of our customers. This partnership will enhance the global data centre footprint and expand the available talent pool that will give us economies of scale,” said Kiran Desai, Senior Vice-President, Global Infrastructure Services, Wipro.
Wipro has expertise across multiple computing environments and platforms, including mainframes, iSeries, Unix, Windows and Linux servers."
99,2018-03-16,Wipro,"Broker’s Call: Wipro (Neutral)
Motilal Oswal
Wipro (Neutral)
CMP: ₹295.75
Target: ₹300
Wipro announced the divestment of its hosted data centre services business to Ensono for $405 million. As part of the deal, it will transition eight data centres and more than 900 employees to Ensono over a two-year period starting in 1QFY19.
 It has also signed a long-term agreement with Ensono to jointly address the hybrid IT requirements of Wipro’s customers. As part of this agreement, it will make a strategic investment of $55 million in the combined entity.
Our earnings estimates for Wipro are largely unchanged following the transaction, as the revenue impact is mostly offset by higher other income and share of profit. At around 16/14x FY19/20E earnings, Wipro’s gradual revenue growth alignment (y-o-y) is captured in our view, despite consistent headwinds from various pockets of problems. We believe that revival in its IT Services EBIT margins, which have fallen around 300 bps from 20.1 per cent in 4QFY16, is key to further upside in the stock."
98,2018-03-27,Wipro,"Wipro launches tech centre in Texas, to raise headcount to 2,000 
 India’s third largest IT services firm Wipro today said it has set up a technology centre in Plano, Texas and plans to ramp up its headcount in the American state to 2,000 people over the next few years.
The centre is focused on developing niche capabilities in new and emerging technologies for Wipro’s clients. The new facility will primarily house Wipro’s US cyber security centre, as well as serve as a hub for advanced analytics, Wipro said in a statement.
“Wipro also plans to ramp up its headcount in Texas to 2,000 over the next few years from 1,400 now,” it added.
In addition to the newly-launched centre in Plano, Wipro has major operations in Dallas and Houston in Texas.
With rising protectionism across markets like the US, Singapore and now Australia, Indian IT companies are adjusting their business models to reduce dependence on visas, hiring more locals instead.
These firms are also setting up newer centres in the US, which accounts for about 60 per cent of India’s IT export basket. Infosys, for example, has said it will set up 4 technology and innovation hubs in the US and hire about 10,000 locals in the US.
To begin with, Wipro’s 45,000-square feet centre will employ 150 people and plans are on the anvil to further increase the workforce at this facility, the company said.
“With more than 1,400 employees in Texas and major operations now in Plano, Dallas and Houston, Wipro is playing an important role in the Texas economy,” Texas Governor Greg Abbott said.
Wipro has forged strong relationships with local universities as part of its effort to recruit the best talent. Over the past year, Wipro has recruited 120 graduates from local universities, including the University of Texas at Austin, University of Texas at Dallas (UT Dallas), University of Houston, Rice University, and University of North Texas (UNT).
The company has a 26,000-square feet facility in Houston, which primarily serves as a hub to drive digital business transformation for its clients from the energy sector.
Wipro also plans to develop a digital pod at the Houston facility, where its clients can leverage design thinking to foster innovation.
During the past decade, Wipro has invested over USD 2 billion in the US. The company has over 40 facilities and employs over 13,000 people in the US, with over 55 per cent being locals."
97,2018-03-29,Wipro,"‘Infosys, Wipro have not developed allotted land’
The Comptroller and Auditor General (CAG) of India has found deficiencies in land allotment procedures in Telangana, leaving vast stretches of allotted land untapped for development by IT companies.
“Land allotments were recommended based on applications by the firms. However, no method was prescribed to assess the extent of land actually required by the firms. As a result, IT firms retained or held the allotted land without full development or utilisation,” the CAG said in its report on Telangana finances in 2016-17, released on Thursday.
For one, Infosys did not take up development in 296 acres (Phase II and III) out of the 446 acres allotted in May 2007. Wipro utilised only nine out of the 101 acres at Gopanapally allotted to it in June 2007, leaving 92 acres of the land idle without any development.
“No investments were stipulated in respect of four firms (Brahmani Infratech, Honeywell Technology, Taksheel Solutions and Linus Infotec). Wipro did not invest the amounts proposed by it, indicating lack of commitment. Nanotech failed to bring in any investment,” it pointed out.
The CAG said the government had accepted the audit observations. “They said it was done in order to attract multinational companies. Infosys had submitted its development plans for approval, while Wipro was being served with a show-cause notice calling for its plan,” it said.
The Department did not monitor development of infrastructure by IT firms in respect of land already allotted. The IT firms held the land allotted without development for years."
96,2018-04-10,Wipro,"Wipro falls 2.5% as client’s insolvency petition may impact Q4 profit
 Wipro shares fell as much as 2.5 per cent as the company had on Monday said that one of its telecom clients in India has filed for bankruptcy and it would impact its profit for the March quarter and year ended March 31, 2018.
""On February 28, 2018, the client filed a petition to initiate its Corporate Insolvency Resolution Process (CIRP) with the National Company Law Tribunal (NCLT),"" Wipro said in a BSE filing. However, it did not name the client.
On February 28, Aircel had filed for bankruptcy. Wipro said it has subsequently submitted its claim on March 28, 2018 and since then has been engaged with the Insolvency Resolution Professional to discuss the potential outcome of the process.
Wipro said it is likely to see an impact on profitability at the net income level in the range of 65-75 basis points of the consolidated revenues for the quarter ended March 31, 2018. The impact of this client insolvency petition will reflect in the financial results of the company for the quarter and year ended March 31, 2018, it added.
In the year 2008, Wipro had signed a multi-year outsourcing services agreement with the telecom client, which was subsequently renewed in 2013.
The IT services provider's stock posted biggest intraday percentage drop since March 26. Up to Monday's close, stock had declined 9 per cent this year after gaining 32.5 per cent last year."
95,2018-04-24,Wipro,"Eyes on Wipro, UltraTech results
Index heavyweights Wipro and UltraTech Cement are among the dozen companies that will declare their quarter and full-year results for the period ended March 2018 on Wednesday. Others include Agro Tech Foods, Bajaj Corp, Future Supply Chain, GHCL, ICICI Lombard General Insurance, Indiabulls Real Estate, Jindal Stainless, KSB Pumps, M&M Financial Services, Reliance Nippon Life Asset Management, Sterlite Tech, Syngene International, Soril Holdings and Wendt (I)."
94,2018-04-25,Wipro,"Wipro Q4 net drops over 20% to Rs 1,800 cr 
 Wipro today posted an over 20 per cent decline in its consolidated profit to Rs 1,800.8 crore for the March quarter 2017-18. The country’s third-largest software services firm had registered a profit of Rs 2,267 crore in the year-ago period, according to Indian accounting norms.
Its total income was down 4.9 per cent at Rs 14,304.6 crore in the fourth quarter of last fiscal, compared to Rs 15,045.5 crore in the January-March period of 2016-17. For the entire financial year ended March 31, Wipro’s profit fell 6 per cent to Rs 8,003.1 crore, while total income dipped 1.7 per cent to Rs 57,035.8 crore over 2016-17."
93,2018-04-26,Wipro,"Wipro hits 7-month low on weak revenue guidance


The stock plunged as much as 4.6 per cent in biggest daily percentage loss since September 14, 2017.




The stock plunged as much as 4.6 per cent in biggest daily percentage loss since September 14, 2017.


 Shares of Wipro fell the most in 7 months as the company’s revenue guidance has disappointed investors. The stock plunged as much as 4.6 per cent in biggest daily percentage loss since September 14, 2017.
The software services exporter's Q4 profit fell 20 per cent to Rs 1,803 crore ($269.5 million), missing analysts estimates. The company sees weak growth in revenue during the current quarter after two clients went bankrupt and it lost business in the US. It expects June-quarter revenue from IT services business in the range of $2.02 billion-$2.07 billion.
Nomura has cut the price target to Rs 260 from Rs 270 with 'reduce' rating. It says Wipro is likely to underperform peers given a weaker presence in developed markets and key verticals.
Morgan Stanley says with most operational parameters running at high levels, it is unsure of margin levers in FY19 other than rupee depreciation. The brokerage says the company’s revenue guidance is a negative surprise.
Kotak Institutional Equities says “perpetual cycle of hope and disappointment continues”; it expects low single-digit growth in FY2019.
Twenty one of 42 brokerages have rated Wipro stock “sell” or lower, seven “buy” or higher, 14 “hold”; their median price target is Rs 290.The stock has fallen 8.6 per cent this year up to Wednesday, compared with a 19 per cent increase in the Nifty IT index.
Wipro's results were bucking the trend from bigger rivals Tata Consultancy Services and Infosys Ltd; both posted a rise in Q4 profit."
92,2018-05-03,Wipro,"Wipro Consumer Care to invest Rs 220 cr for new facility in Telangana 
 Wipro Consumer Care and Lighting today said it plans to invest Rs 220 crore to set up a new manufacturing facility for personal care products in Telangana.
 The company, which today reported revenues of over Rs 6,630 crore ($ 1 billion) for financial year 2017-18, also plans to set up a manufacturing facility in Guangzhou in China.
 “Wipro Consumer Care products division will invest Rs 220 crore to set up a manufacturing facility at Maheshwaram in Rangareddy district. Coming up on 40 acres, the facility will manufacture toilet soaps and other personal care products,” a spokesperson of Wipro Consumer Care and Lighting told PTI.
 The company, however, did not elaborate on the new manufacturing facility coming up in China.
 Both the facilities are expected to be operational in fiscal 2020, the company added.
 Commenting on achieving the $ 1 billion revenue milestone, Wipro Consumer Care and Lighting CEO Vineet Agrawal said: “The key driver of growth this year was our ability to handle the GST transition in India...This gave us momentum in June-July 2017, leading to 18 per cent growth in the India business in 2017-18. Distribution also improved especially post GST implementation“.
 The company had reported revenues of Rs 6,114 crore in fiscal 2016-17.
 Wipro Consumer Care’s brand portfolio includes Santoor, Chandrika, Safewash Enchanteur and Yardley.
 The company has 15 manufacturing facilities in five countries (India, China, Malaysia, Indonesia and Vietnam)."
91,2018-05-04,Wipro,"Wipro hits 10-month low; chart signals further downside
 Wipro shares today hit 10-month low and the chart has signalled further downside. The stock fell as much as 2.73 per cent to Rs 264.05, its lowest since July 14, 2017.
The stock's 50-day exponential moving average (EMA) has cut below its 200-day EMA, and a bearish trend is seen in the near-to-medium term.
The stock has also broken below a support at Rs 269, the 50 per cent Fibonacci retracement level of the uptrend from November 9, 2016 low to January 16, 2018 high. A negative MACD, which is below its signal line, is also unfavourable for the stock.
The nearest Fibonacci retracement support levels for the stock are placed at Rs 253.7 and Rs 234.7, while resistance is at Rs 269 and Rs 284.4.
In the last one month, analysts have cut Wipro's FY 2019 net profit estimates by 8.41 per cent compared with a cut of 2.7 per cent for Indian IT stocks, according to TR Eikon data. Wipro shares were down 13.6 per cent this year as of Thursday's close, while the Nifty IT Index gained 15.5 pct"
90,2018-05-09,Wipro,"Wipro seeks stakeholder nod to merge 4 units with itself


Wipro has sought shareholder approval to merge four of its entities into the parent company.
In a filing to the stock exchanges, India’s third largest software exporter said that Wipro Technologies Austria, Wipro Information Technology Austria, Newlogic Technologies and Appirio India Cloud Solutions will be merged into Wipro Limited.
Wipro Technologies Austria, Wipro Information Technology Austria and NewLogic Technologies which are part of the NewLogic Technologies group was acquired by Wipro in 2005, are leading semi-conductor design services providers and suppliers of Intellectual Property (IP) cores for wireless and wireline applications. 
NewLogic Technologies owns IPs in this segment which contains software, wireless LAN multi-band radio module and mixed-signal blocks, the company said in a statement. Further, Appirio India Cloud Solutions Private Limited is a cloud application services provider which Wipro acquired.
Wipro said that the rationale behind the consolidation had factored in several reasons. The consolidation will provide access to the intangible assets, licenses and intellectual properties, which will lead to synergies of operations, reduction in overheads including administrative, managerial and other expenditure, operational rationalisation, organisational efficiency and optimal utilisation of resources. 
Further, the combined entity will have a bigger portfolio of services targeted at a larger customer base, which will strengthen its position. 
Also, it said that there will be significant reduction in the multiplicity of legal and regulatory compliances requirements."
89,2018-05-28,Wipro,"Wipro localising more in US: Rishad Premji 
 Indian IT services giant Wipro is localising more in the US and more than half of its workforce in the country now consists of locals, the company’s Chief Strategy Officer Rishad Premji said, asserting that the firm is very committed to the US market. 
Premji, who is a member of the board at Wipro, said Wipro currently has a workforce of over 14,000 employees in the US and 58 per cent of those are locals. Under the Donald Trump administration, there is heightened scrutiny of the H1B work visa programme, which several lawmakers allege is being abused to replace Americans with foreign workers. 
The H1B visa is a non-immigrant visa that allows US companies to employ foreign workers in speciality occupations that require theoretical or technical expertise. The technology companies depend on it to hire tens of thousands of employees each year from countries such as India and China. 
Since taking office, Trump has ordered an overhaul of the H1B visa programme to check visa fraud and abuse, and his administration has taken steps to tighten scrutiny of applications, adding to the uncertainty and anxiety of thousands of IT workers on the visas over their future. 
“So we are not a 50-50 company. (The US) still remains one of our largest markets so it’s an area of big focus for growth and I think if you cannot win in the US market, you really won’t win globally,” Premji told PTI in an interview here. 
Premji, who was in the city to address the NASSCOM C-Summit last week, said Wipro is very committed to the US market. Premji is also the chairman of the National Association of Software and Services Companies (NASSCOM). “We are localizing more, we are hiring on a very structured basis from campus, which has been very very successful,” he said. 
In June last year, Wipro said in a press release that locals formed over 50 per cent of its US workforce. In the first half of last year, Wipro had hired over 1,600 employees by attracting and nurturing local talent to drive innovation and help transform clients’ businesses into digital enterprises . 
During the past decade, Wipro said it has invested over two billion dollars in the US, according to the company press release. The company has been focused on creating jobs in the US, underscoring its strategy to “build a deep reservoir of local talent based out of centers close to its clients”. 
 During FY16-17, over 3,000 locals joined Wipro and the company would continue to recruit from top universities to build on the momentum of hiring locally in the United States, the press release had said. 
Premji added that Wipro has been hiring from campuses in the US for two years now and plans to scale that going forward. Wipro also continues to invest in centres in the US and as part of this, it had last year launched a multi-million dollar Silicon Valley Innovation Centre in Mountain View, California. 
Premji said Wipro also continues to invest from a Corporate Social Responsibility (CSR) perceptive in the US as well and a big focus for it is to help elevate the quality of STEM (science, technology, engineering and mathematics) talent in the US. 
Wipro is working with certain universities that support programmes with teachers who can enhance their own STEM capabilities to then “produce better STEM-educated students in disadvantaged communities, Tier-2 and Tier-3 districts of the US, Premji said. 
“We have a huge amount of commitment to this market, we want to be ingrained in the very natural fibre and fabric of this market and the communities in which we work and live and where our employees work and live,” Premji said."
88,2018-07-13,Wipro,"Wipro shares jump to 6-month high
 Wipro shares gained the most in 6 months, and the chart suggests further upside. The stock jumped as much as 3.7 per cent, its biggest intraday gain since January 16.








 
The stock has broken above a resistance at Rs 284.36, the 38.2 per cent Fibonacci retracement level of the uptrend from November 9, 2016 low to January 16, 2018 high. Wipro also broke above its 200-day exponential moving average on Thursday.
The stock's wave pattern suggests the end of a corrective cycle and that it is in the initial wave 1 of a five-wave uptrend. Trend Intensity indicator has gone up to 21, and it confirms that the prices are trending upwards. MACD is also positive and above its signal line.
The five-day average volume is 25 per cent higher than the 30-day average, which is seen favourable for the stock. The stock had fallen 11.1 per cent this year as of its last close, while the broader NSE Index was up 4.7 per cent in the same period."
